objectid,cross2,notes,orderid,title,description,creator,location,date,dateCreated:start,dateCreated:end,type,content_type,format,subject,subject#0,subject#1,subject#2,subject#3,subject#4,subject#5,filename,customtext:LCHSObjectID,rights,location:placename/en2,locationCreated:placename,display_template,object_location,image_small,image_thumb
01-02-001,01-02-001,,,Main Street Parade,A parade on Main Street of Moscow in June 1934 with soldiers parading with a flag.,,"Moscow, Idaho",1934-06,1934-06,,Image;StillImage,PHOTOGRAPH,image/jpeg,Main Street; Parade; Flag; Soldiers; Vandal Cafe; Billiards,Main Street,Parade,Flag,Soldiers,Vandal Cafe ,Billiards,01-02-001.jpg,01-02-001,"Copyright, Latah County Historical Society Collections.  All Rights reserved, contact the Latah County Historical Society for reproduction information.",,,image,https://latahcountyhistory.sfo3.digitaloceanspaces.com/moscow/01-02-001.jpg,https://latahcountyhistory.sfo3.digitaloceanspaces.com/moscow/small/01-02-001_sm.jpg,https://latahcountyhistory.sfo3.digitaloceanspaces.com/moscow/thumbs/01-02-001_th.jpg
01-02-002,01-02-002,,,Third and Main,"Corner of Third and Main Street in Moscow, Idaho.",,"Moscow, Idaho",1970,1970,,Image;StillImage,PHOTOGRAPH,image/jpeg,Main Street; Third Street; Hodgins Drugs; Jackle Jewelry; Banks; Downtown,Main Street,Third Street,Hodgins Drugs,Jackle Jewelery,Bank,Downtown,01-02-002.jpg,01-02-002,"Copyright, Latah County Historical Society Collections.  All Rights reserved, contact the Latah County Historical Society for reproduction information.",,,image,https://latahcountyhistory.sfo3.digitaloceanspaces.com/moscow/01-02-002.jpg,https://latahcountyhistory.sfo3.digitaloceanspaces.com/moscow/small/01-02-002_sm.jpg,https://latahcountyhistory.sfo3.digitaloceanspaces.com/moscow/thumbs/01-02-002_th.jpg
01-02-003,01-02-003,,,Early Moscow First and Main Street,"Looking North from left to right is City Hall (two story building, Frye Hotel, Bank Exchange, White's Drug store, Mconnell & Co.",,"Moscow, Idaho",1885,1885,,Image;StillImage,PHOTOGRAPH,image/jpeg,Main Street; First Street; McConnell and Company; Frye Hotel; City Hall; White's Drug Store,Main Street,First Street,McConnell and Company,Frye Hotel,City Hall,White's Drug Store,01-02-003.jpg,01-02-003,"Copyright, Latah County Historical Society Collections.  All Rights reserved, contact the Latah County Historical Society for reproduction information.",,,image,https://latahcountyhistory.sfo3.digitaloceanspaces.com/moscow/01-02-003.jpg,https://latahcountyhistory.sfo3.digitaloceanspaces.com/moscow/small/01-02-003_sm.jpg,https://latahcountyhistory.sfo3.digitaloceanspaces.com/moscow/thumbs/01-02-003_th.jpg
01-02-004,01-02-004,,,Old Band Stand on Fourth and Main Street,The Old Band Stand near Fourth and Main Streets. The bandstand played at various location every Friday night during the summer with a 20 piece band with Ed Carey as band leader.  The small bus in front of Hotel Moscow carried people from the depot to the hotel.,,"Moscow, Idaho",1917-07,1917-07,,Image;StillImage,PHOTOGRAPH,image/jpeg,Main Street; Fourth Street; Moscow Hotel; F. A. Davids'; Downtown Moscow; Flag,Main Street,Fourth Street,Hotel Moscow,F. A. Davids' ,Downtown Moscow,Flag,01-02-004.jpg,01-02-004,"Copyright, Latah County Historical Society Collections.  All Rights reserved, contact the Latah County Historical Society for reproduction information.",,,image,https://latahcountyhistory.sfo3.digitaloceanspaces.com/moscow/01-02-004.jpg,https://latahcountyhistory.sfo3.digitaloceanspaces.com/moscow/small/01-02-004_sm.jpg,https://latahcountyhistory.sfo3.digitaloceanspaces.com/moscow/thumbs/01-02-004_th.jpg
01-02-005,01-02-005,,,Neptune Hose Cart Company,"Pictured is the Neptune Hose Cart Copany on Main Street of Moscow, facing south between 4th and 5th Streets. Figure pictured on the far left is Dr. James McLean, University of Idaho President. Dr. Mclean served as the fire department's first assistant engineer for several years.",,"Moscow, Idaho",1900,1900,,Image;StillImage,PHOTOGRAPH,image/jpeg,Main Street; Neptune Hose Cart Company; James McLean; Fire Department; Pacific Coast Elevator Company; Flag,Main Street,Neptune Hose Cart Company,James McLean,Fire Department,Pacific Coast Elevator Company,Flag,01-02-005.jpg,01-02-005,"Copyright, Latah County Historical Society Collections.  All Rights reserved, contact the Latah County Historical Society for reproduction information.",,,image,https://latahcountyhistory.sfo3.digitaloceanspaces.com/moscow/01-02-005.jpg,https://latahcountyhistory.sfo3.digitaloceanspaces.com/moscow/small/01-02-005_sm.jpg,https://latahcountyhistory.sfo3.digitaloceanspaces.com/moscow/thumbs/01-02-005_th.jpg
01-02-006,01-02-006,,,Hose Cart Company #4,"Hose Cart Company of Moscow, Idaho looking South on Main Street in fron of the Crystal Theatre.",,"Moscow, Idaho",1900,1900,,Image;StillImage,PHOTOGRAPH,image/jpeg,Main Street; Fifth Street; Crystal Theatre; Hose Cart Company; Williamson's; Moscow Fire Department,Main Street,Fifth Street,Crystal Theatre,Hose Cart Company,Williamson's,Moscow Fire Department,01-02-006.jpg,01-02-006,"Copyright, Latah County Historical Society Collections.  All Rights reserved, contact the Latah County Historical Society for reproduction information.",,,image,https://latahcountyhistory.sfo3.digitaloceanspaces.com/moscow/01-02-006.jpg,https://latahcountyhistory.sfo3.digitaloceanspaces.com/moscow/small/01-02-006_sm.jpg,https://latahcountyhistory.sfo3.digitaloceanspaces.com/moscow/thumbs/01-02-006_th.jpg
01-02-007,01-02-007,,,Moscow's First Dentist,J.H. McCalie's Dental Surgery was the home and office of Moscow's first dentist located on Main Street. White and White Drug Store is the building to the right at 1st and Main Street.,,"Moscow, Idaho",1880,1880,,Image;StillImage,PHOTOGRAPH,image/jpeg,Main Street; Dentist; McCallie; White's Drug Store; Lillie Lieauallen; Downtown,Main Street,Dentist,McCallie,White's Drug Store,Lillie Lieauallen,Downtown,01-02-007.jpg,01-02-007,"Copyright, Latah County Historical Society Collections.  All Rights reserved, contact the Latah County Historical Society for reproduction information.",,,image,https://latahcountyhistory.sfo3.digitaloceanspaces.com/moscow/01-02-007.jpg,https://latahcountyhistory.sfo3.digitaloceanspaces.com/moscow/small/01-02-007_sm.jpg,https://latahcountyhistory.sfo3.digitaloceanspaces.com/moscow/thumbs/01-02-007_th.jpg
01-02-008,01-02-008,,,July 4th Hose Cart Company,"Hose Cart Company of Moscow, Idaho going down Main Street on July 4th of 1911. In front of the Lumber company in the background is a wagon with blocks of ice being carted around.",,"Moscow, Idaho",1911,1911,,Image;StillImage,PHOTOGRAPH,image/jpeg,Main Street; Hose Cart Company; Tom Keene; Potlatch Lumber Company; Downtown Moscow; Flag,Main Street,Hose Cart Company,Tom Keene,Potlatch Lumber Company,Downtown Moscow,Flag,01-02-008.jpg,01-02-008,"Copyright, Latah County Historical Society Collections.  All Rights reserved, contact the Latah County Historical Society for reproduction information.",,,image,https://latahcountyhistory.sfo3.digitaloceanspaces.com/moscow/01-02-008.jpg,https://latahcountyhistory.sfo3.digitaloceanspaces.com/moscow/small/01-02-008_sm.jpg,https://latahcountyhistory.sfo3.digitaloceanspaces.com/moscow/thumbs/01-02-008_th.jpg
01-02-009,01-02-009,,,Girl's Race Postcard,"Postcard showing the Girl's Race that took place on Moscow's Main Street on July 4th, 1911.",,"Moscow, Idaho",1911,1911,,Image;StillImage,PHOTOGRAPH,image/jpeg,Main Street; Postcard; July 4th; Girl's Race; Downtown Moscow; Martin Photo,Main Street,Postcard,July 4th ,Girl's Race,Downtown Moscow,Martin Photo,01-02-009.jpg,01-02-009,"Copyright, Latah County Historical Society Collections.  All Rights reserved, contact the Latah County Historical Society for reproduction information.",,,image,https://latahcountyhistory.sfo3.digitaloceanspaces.com/moscow/01-02-009.jpg,https://latahcountyhistory.sfo3.digitaloceanspaces.com/moscow/small/01-02-009_sm.jpg,https://latahcountyhistory.sfo3.digitaloceanspaces.com/moscow/thumbs/01-02-009_th.jpg
01-02-010,01-02-010,,,"July 4, 1911 Postcard","Main Street and corner of Third Street look at the east side of the street on July 4, 1911 in Moscow, Idaho.",,"Moscow, Idaho",1911,1911,,Image;StillImage,PHOTOGRAPH,image/jpeg,Main Street; Postcard; July 4th; Martin Photo; Downtown Moscow; Gathering,Main Street,Postcard,July 4th ,Martin Photo,Downtown Moscow,Gathering,01-02-010.jpg,01-02-010,"Copyright, Latah County Historical Society Collections.  All Rights reserved, contact the Latah County Historical Society for reproduction information.",,,image,https://latahcountyhistory.sfo3.digitaloceanspaces.com/moscow/01-02-010.jpg,https://latahcountyhistory.sfo3.digitaloceanspaces.com/moscow/small/01-02-010_sm.jpg,https://latahcountyhistory.sfo3.digitaloceanspaces.com/moscow/thumbs/01-02-010_th.jpg
01-02-011,01-02-011,,,Moscow's Greatest Celebration,"Parade on Main Street of Moscow, Idaho. Banner in the background reads ""Moscow's Greatest Celebration"".",,"Moscow, Idaho",1905,1905,1915,Image;StillImage,PHOTOGRAPH,image/jpeg,Main Street; Street Scene; Celebration; Parade; Flag; Downtown Moscow,Main Street,Street Scene,Celebration,Parade,Flag,Downtown Moscow,01-02-011.jpg,01-02-011,"Copyright, Latah County Historical Society Collections.  All Rights reserved, contact the Latah County Historical Society for reproduction information.",,,image,https://latahcountyhistory.sfo3.digitaloceanspaces.com/moscow/01-02-011.jpg,https://latahcountyhistory.sfo3.digitaloceanspaces.com/moscow/small/01-02-011_sm.jpg,https://latahcountyhistory.sfo3.digitaloceanspaces.com/moscow/thumbs/01-02-011_th.jpg
01-02-012,01-02-012,,,Downtown Christmas,Photo taken of downtown at night on Christmas from The Idahonian files.,,"Moscow, Idaho",1930,1930,1940,Image;StillImage,PHOTOGRAPH,image/jpeg,Downtown Moscow; Snow; Christmas; Night; Rooftop Photo; Street Scene,Downtown Moscow,Snow,Christmas,Night ,Rooftop Photo,Street Scene,01-02-012.jpg,01-02-012,"Copyright, Latah County Historical Society Collections.  All Rights reserved, contact the Latah County Historical Society for reproduction information.",,,image,https://latahcountyhistory.sfo3.digitaloceanspaces.com/moscow/01-02-012.jpg,https://latahcountyhistory.sfo3.digitaloceanspaces.com/moscow/small/01-02-012_sm.jpg,https://latahcountyhistory.sfo3.digitaloceanspaces.com/moscow/thumbs/01-02-012_th.jpg
01-02-014,01-02-014,,,Marching Band,"Moscow High School Marching Band in a parade on Main Street, Moscow.",,"Moscow, Idaho",1930,1930,1940,Image;StillImage,PHOTOGRAPH,image/jpeg,Main Street; Nobby Inn; Washington Water & Power; Fonk's Stores; Hutchison Studio; Marching Band,Main Street,Nobby Inn,Washington Water Power,Fonk's Stores,Hutchison Studio,Marching Band,01-02-014.jpg,01-02-014,"Copyright, Latah County Historical Society Collections.  All Rights reserved, contact the Latah County Historical Society for reproduction information.",,,image,https://latahcountyhistory.sfo3.digitaloceanspaces.com/moscow/01-02-014.jpg,https://latahcountyhistory.sfo3.digitaloceanspaces.com/moscow/small/01-02-014_sm.jpg,https://latahcountyhistory.sfo3.digitaloceanspaces.com/moscow/thumbs/01-02-014_th.jpg
01-02-015,01-02-015,,,Main Street World War II Parade,Parade marching down Main Street in Moscow during World War II.,,"Moscow, Idaho",1940,1940,,Image;StillImage,PHOTOGRAPH,image/jpeg,Main Street; Parade; World War II; JC Penney; Kenworthy; Nuart,Main Street,Parade,World War II,JC Penney,Kenworthy,Nuart,01-02-015.jpg,01-02-015,"Copyright, Latah County Historical Society Collections.  All Rights reserved, contact the Latah County Historical Society for reproduction information.",,,image,https://latahcountyhistory.sfo3.digitaloceanspaces.com/moscow/01-02-015.jpg,https://latahcountyhistory.sfo3.digitaloceanspaces.com/moscow/small/01-02-015_sm.jpg,https://latahcountyhistory.sfo3.digitaloceanspaces.com/moscow/thumbs/01-02-015_th.jpg
01-02-016,01-02-016,,,Fat Man's Race,"Fourth of July Fat Man's Race on Main Street in  Moscow. ""Several fat men and Casper Tyleden in the dark vest and pants entererd the race. Someone said put a rider on the big Swede he is not a fat man, however he weighed the minimum. The other fat men who started the race had dropped out when the picture was taken. Tylden was just gaining his speed at this point and won the race by quite a margin. His comment after the race was, ""If we had to have gone further I would have beat him badly"".",,"Moscow, Idaho",1911-07-04,1911-07-04,,Image;StillImage,PHOTOGRAPH,image/jpeg,Main Street; Fat Man's Race; Fourth of July; Cloak Store; Parade; Moscow Hotel,Main Street,Fat Man's Race,Fourth of July,Cloak Store,Parade,Moscow Hotel,01-02-016.jpg,01-02-016,"Copyright, Latah County Historical Society Collections.  All Rights reserved, contact the Latah County Historical Society for reproduction information.",,,image,https://latahcountyhistory.sfo3.digitaloceanspaces.com/moscow/01-02-016.jpg,https://latahcountyhistory.sfo3.digitaloceanspaces.com/moscow/small/01-02-016_sm.jpg,https://latahcountyhistory.sfo3.digitaloceanspaces.com/moscow/thumbs/01-02-016_th.jpg
01-02-017,01-02-017,,,World War II Parade,A parade in Moscow on Main Street that took place during World War II for Army Day.,,"Moscow, Idaho",1940,1940,,Image;StillImage,PHOTOGRAPH,image/jpeg,Main Street; Parade; World War II; Nuart; Kenworthy; Paper House,Main Street,Parade,World War II,Nuart,Kenworthy,Paper House,01-02-017.jpg,01-02-017,"Copyright, Latah County Historical Society Collections.  All Rights reserved, contact the Latah County Historical Society for reproduction information.",,,image,https://latahcountyhistory.sfo3.digitaloceanspaces.com/moscow/01-02-017.jpg,https://latahcountyhistory.sfo3.digitaloceanspaces.com/moscow/small/01-02-017_sm.jpg,https://latahcountyhistory.sfo3.digitaloceanspaces.com/moscow/thumbs/01-02-017_th.jpg
01-02-018,01-02-018,,,Main Street Postcard,Tinted Postcard of Main Street Moscow.,,"Moscow, Idaho",1911,1911,,Image;StillImage,PHOTOGRAPH,image/jpeg,Main Street; Postcard; Downtown Moscow; Spokane Postcard Company; Local Business; Tinted Postcard,Main Street,Postcard,Downtown Moscow,Spokane Postcard Company,Local Business,Tinted Postcard,01-02-018.jpg,01-02-018,"Copyright, Latah County Historical Society Collections.  All Rights reserved, contact the Latah County Historical Society for reproduction information.",,,image,https://latahcountyhistory.sfo3.digitaloceanspaces.com/moscow/01-02-018.jpg,https://latahcountyhistory.sfo3.digitaloceanspaces.com/moscow/small/01-02-018_sm.jpg,https://latahcountyhistory.sfo3.digitaloceanspaces.com/moscow/thumbs/01-02-018_th.jpg
01-02-019,01-02-019,,,Fourth and Main Street Postcard,A postcard of Fourth and Main Street in Downtown Moscow Idaho.,,"Moscow, Idaho",1915,1915,,Image;StillImage,PHOTOGRAPH,image/jpeg,Main Street; Fourth Street; Postcard; Downtown Moscow; Corner Drug Store; Glenn's News,Main Street,Fourth Street,Postcard,Downtown Moscow,Corner Drug Store,Glenn's News,01-02-019.jpg,01-02-019,"Copyright, Latah County Historical Society Collections.  All Rights reserved, contact the Latah County Historical Society for reproduction information.",,,image,https://latahcountyhistory.sfo3.digitaloceanspaces.com/moscow/01-02-019.jpg,https://latahcountyhistory.sfo3.digitaloceanspaces.com/moscow/small/01-02-019_sm.jpg,https://latahcountyhistory.sfo3.digitaloceanspaces.com/moscow/thumbs/01-02-019_th.jpg
01-02-020,01-02-020,,,East Side Main Street Postcard,A postcard of the east side of Main Street.,,"Moscow, Idaho",1914,1914,,Image;StillImage,PHOTOGRAPH,image/jpeg,Main Street; Postcard; Williamson's; Cloak Store; Downtown Moscow; Moscow Business College,Main Street,Postcard,Williamson's ,Cloak Store,Downtown Moscow,Moscow Business College,01-02-020.jpg,01-02-020,"Copyright, Latah County Historical Society Collections.  All Rights reserved, contact the Latah County Historical Society for reproduction information.",,,image,https://latahcountyhistory.sfo3.digitaloceanspaces.com/moscow/01-02-020.jpg,https://latahcountyhistory.sfo3.digitaloceanspaces.com/moscow/small/01-02-020_sm.jpg,https://latahcountyhistory.sfo3.digitaloceanspaces.com/moscow/thumbs/01-02-020_th.jpg
01-02-021,01-02-021,,,Main and Third Street,Photograph of Main Street and Third Street facing east where some wooden sidewalks can be seen.,,"Moscow, Idaho",1885,1885,,Image;StillImage,PHOTOGRAPH,image/jpeg,Main Street; Third Street; W.W. Langdon Store; G. Weber's Harness Shop; Liquor Store; Saloon,Main Street,Third Street,W.W. Langdon Store,G. Weber's Harness Shop,Liquor Store,Saloon,01-02-021.jpg,01-02-021,"Copyright, Latah County Historical Society Collections.  All Rights reserved, contact the Latah County Historical Society for reproduction information.",,,image,https://latahcountyhistory.sfo3.digitaloceanspaces.com/moscow/01-02-021.jpg,https://latahcountyhistory.sfo3.digitaloceanspaces.com/moscow/small/01-02-021_sm.jpg,https://latahcountyhistory.sfo3.digitaloceanspaces.com/moscow/thumbs/01-02-021_th.jpg
01-02-022,01-02-022,,,Celebrating the Armistice,A celebration and parade on Main Street in regards to the Signing of the Armistice in 1918.,,"Moscow, Idaho",1918,1918,,Image;StillImage,PHOTOGRAPH,image/jpeg,Armistice; Celebration; Hodgins Photo; Main Street; Williamson's; Parade,Armistice,Celebration,Hodgins Photo,Main Street,Williamson's,Parade,01-02-022.jpg,01-02-022,"Copyright, Latah County Historical Society Collections.  All Rights reserved, contact the Latah County Historical Society for reproduction information.",,,image,https://latahcountyhistory.sfo3.digitaloceanspaces.com/moscow/01-02-022.jpg,https://latahcountyhistory.sfo3.digitaloceanspaces.com/moscow/small/01-02-022_sm.jpg,https://latahcountyhistory.sfo3.digitaloceanspaces.com/moscow/thumbs/01-02-022_th.jpg
01-02-024,01-02-024,,,Parade Postcard,A pararade on Main Streeet of Moscow in 1915 featured on a postcard. The photo shows Florence and Myra Fenn pulling their brother Charles in a card on Main Street.,,"Moscow, Idaho",1915,1915,,Image;StillImage,PHOTOGRAPH,image/jpeg,Main Street; Parade; Pastime; Postcard; Downtown Moscow; Celebration,Main Street,Parade,Pastime,Postcard,Downtown Moscow,Celebration,01-02-024.jpg,01-02-024,"Copyright, Latah County Historical Society Collections.  All Rights reserved, contact the Latah County Historical Society for reproduction information.",,,image,https://latahcountyhistory.sfo3.digitaloceanspaces.com/moscow/01-02-024.jpg,https://latahcountyhistory.sfo3.digitaloceanspaces.com/moscow/small/01-02-024_sm.jpg,https://latahcountyhistory.sfo3.digitaloceanspaces.com/moscow/thumbs/01-02-024_th.jpg
01-02-025,01-02-025,,,Moscow High School,"A photograph at Adams Street and Third Street showing Moscow High School, now the 1912 Center, and Methodist Church.",,"Moscow, Idaho",1915,1915,,Image;StillImage,PHOTOGRAPH,image/jpeg,Adams Street; Moscow High School; Methodist Church; 1912 Center; Street Scene; Third Street,Adams Street,Moscow High School,Methodist church,1912 Center,Street Scene ,Third Street,01-02-025.jpg,01-02-025,"Copyright, Latah County Historical Society Collections.  All Rights reserved, contact the Latah County Historical Society for reproduction information.",,,image,https://latahcountyhistory.sfo3.digitaloceanspaces.com/moscow/01-02-025.jpg,https://latahcountyhistory.sfo3.digitaloceanspaces.com/moscow/small/01-02-025_sm.jpg,https://latahcountyhistory.sfo3.digitaloceanspaces.com/moscow/thumbs/01-02-025_th.jpg
01-02-027,01-02-027,,,Marching Band on Main Street,Marching Band on Main Street in Moscow in a parade.,,"Moscow, Idaho",1911,1911,,Image;StillImage,PHOTOGRAPH,image/jpeg,Potlatch Lumber Company; Welcome Banner; Celebration; Marching Band; Parade; Main Street,Potlatch Lumber Company,Welcome Banner,Celebration,Marching Band,Parade,Main Street,01-02-027.jpg,01-02-027,"Copyright, Latah County Historical Society Collections.  All Rights reserved, contact the Latah County Historical Society for reproduction information.",,,image,https://latahcountyhistory.sfo3.digitaloceanspaces.com/moscow/01-02-027.jpg,https://latahcountyhistory.sfo3.digitaloceanspaces.com/moscow/small/01-02-027_sm.jpg,https://latahcountyhistory.sfo3.digitaloceanspaces.com/moscow/thumbs/01-02-027_th.jpg
01-02-029,01-02-029,,,Horse Cart Advertising,A horse cart advertises Inland Market in front of Tom Keene Cigar Store during the 1911 Fourth of July Parade in Moscow.,,"Moscow, Idaho",1911,1911,,Image;StillImage,PHOTOGRAPH,image/jpeg,Inland Market; Fourth of July; Parade; Tom Keene Cigar; Downtown Moscow; Celebration,Inland Market,Fourth of July,Parade,Tom Keene Cigar ,Downtown Moscow,Celebration,01-02-029.jpg,01-02-029,"Copyright, Latah County Historical Society Collections.  All Rights reserved, contact the Latah County Historical Society for reproduction information.",,,image,https://latahcountyhistory.sfo3.digitaloceanspaces.com/moscow/01-02-029.jpg,https://latahcountyhistory.sfo3.digitaloceanspaces.com/moscow/small/01-02-029_sm.jpg,https://latahcountyhistory.sfo3.digitaloceanspaces.com/moscow/thumbs/01-02-029_th.jpg
01-02-030,01-02-030,,,Main Street Postcard,A postcard ca. 1910 showing the Main Street of Moscow.,,"Moscow, Idaho",1910,1910,,Image;StillImage,PHOTOGRAPH,image/jpeg,Postcard; Main Street; Downtown Moscow; Moscow Hotel; Hodgins Drugs; Williamson's,Postcard,Main Street,Downtown Moscow,Moscow Hotel,Hodgins Drugs,Williamsons,01-02-030.jpg,01-02-030,"Copyright, Latah County Historical Society Collections.  All Rights reserved, contact the Latah County Historical Society for reproduction information.",,,image,https://latahcountyhistory.sfo3.digitaloceanspaces.com/moscow/01-02-030.jpg,https://latahcountyhistory.sfo3.digitaloceanspaces.com/moscow/small/01-02-030_sm.jpg,https://latahcountyhistory.sfo3.digitaloceanspaces.com/moscow/thumbs/01-02-030_th.jpg
01-02-031,01-02-031,,,Main and Fourth Street Postcard,A postcard looking North at Main Street with Fourth street in the foreground taken in the early 1900's before the streets were paved in 1912.,,"Moscow, Idaho",1910,1910,,Image;StillImage,PHOTOGRAPH,image/jpeg,Postcard; Main Street; Fourth Street; McConnell-Maguire; Motter Wheeler; Downtown Moscow,Postcard,Main Street,Fourth Street,McConnell-Maguire,Motter-Wheeler,Downtown Moscow,01-02-031.jpg,01-02-031,"Copyright, Latah County Historical Society Collections.  All Rights reserved, contact the Latah County Historical Society for reproduction information.",,,image,https://latahcountyhistory.sfo3.digitaloceanspaces.com/moscow/01-02-031.jpg,https://latahcountyhistory.sfo3.digitaloceanspaces.com/moscow/small/01-02-031_sm.jpg,https://latahcountyhistory.sfo3.digitaloceanspaces.com/moscow/thumbs/01-02-031_th.jpg
01-02-032,01-02-032,,,Moscow Holiday Postcard,A tinted Holiday Postcard showing a scene of Main Street.,,"Moscow, Idaho",1940,1940,,Image;StillImage,PHOTOGRAPH,image/jpeg,Postcard; Main Street; Williamson's; Holiday; Christmas; Downtown Moscow,Postcard,Main Street,Williamson's ,Holiday ,Christmas,Downtown Moscow,01-02-032.jpg,01-02-032,"Copyright, Latah County Historical Society Collections.  All Rights reserved, contact the Latah County Historical Society for reproduction information.",,,image,https://latahcountyhistory.sfo3.digitaloceanspaces.com/moscow/01-02-032.jpg,https://latahcountyhistory.sfo3.digitaloceanspaces.com/moscow/small/01-02-032_sm.jpg,https://latahcountyhistory.sfo3.digitaloceanspaces.com/moscow/thumbs/01-02-032_th.jpg
01-02-033,01-02-033,,,Moscow Pedestrians,Photograph shows pedestrians walking on Main Street across from Fonk's 5 cent and 1 dollar store looking West between Fourth and Fifth Street.,,"Moscow, Idaho",1950,1950,,Image;StillImage,PHOTOGRAPH,image/jpeg,Main Street; Pedestrians; Fonk's; Fourth Street; Fifth Street; Downtown Moscow,Main Street,Pedestrians,Fonk's,Fourth Street,Fifth Street,Downtown Moscow,01-02-033.jpg,01-02-033,"Copyright, Latah County Historical Society Collections.  All Rights reserved, contact the Latah County Historical Society for reproduction information.",,,image,https://latahcountyhistory.sfo3.digitaloceanspaces.com/moscow/01-02-033.jpg,https://latahcountyhistory.sfo3.digitaloceanspaces.com/moscow/small/01-02-033_sm.jpg,https://latahcountyhistory.sfo3.digitaloceanspaces.com/moscow/thumbs/01-02-033_th.jpg
01-02-034,01-02-034,,,Firefighters spraying water on a blaze on Main Street with fire hoses. the fire broke out between 2nd and 3rd streets between Shorty's and Maxine's.,Frfighters spraying water on a blaze on Main Street with fire hoses. the fire broke out between 2nd and 3rd streets between Shorty's and Maxine's.,,"Moscow, Idaho",1953-01-31,1953-01-31,,Image;StillImage,PHOTOGRAPH,image/jpeg,Main Street; Firefighters; Hose; Mid Century; Water; Idaho,Main Street,Firefighters,Hose,Mid Century,Water,Idaho,01-02-034.jpg,01-02-034,"Copyright, Latah County Historical Society Collections.  All Rights reserved, contact the Latah County Historical Society for reproduction information.",,,image,https://latahcountyhistory.sfo3.digitaloceanspaces.com/moscow/01-02-034.jpg,https://latahcountyhistory.sfo3.digitaloceanspaces.com/moscow/small/01-02-034_sm.jpg,https://latahcountyhistory.sfo3.digitaloceanspaces.com/moscow/thumbs/01-02-034_th.jpg
