objectid,cross2,notes,orderid,title,description,creator,location,date,dateCreated:start,dateCreated:end,type,content_type,format,subject,subject#0,subject#1,subject#2,subject#3,subject#4,subject#5,filename,customtext:LCHSObjectID,rights,location:placename/en2,locationCreated:placename,display_template,object_location,image_small,image_thumb
01-03-634,01-03-634,,,Latah County Grain Growers building demolition,"Demolition of the Latah County Grain Growers building at 6th and Jackson Streets.  Building on left had been Mark P. Miller flour mill warehouse, Blue Stem Flour being the chief product, prized by housewives all over the Northwest.  The concrete tank elevators on the right (still standing as of 2018) were also built by Mark P. Miller.  The company continued here under his name until about 1958.",Julie Monroe,"Moscow, Idaho",2002,2002,,Image;StillImage,PHOTOGRAPH,image/jpeg,Grain growers; Warehouse; Mark P. Miller; Elevators; Moscow; Idaho,Grain growers,Warehouse,Mark P. Miller,Elevators,Moscow,Idaho,01-03-634.jpg,01-03-634,"Copyright, Latah County Historical Society Collections.  All Rights reserved, contact the Latah County Historical Society for reproduction information.","Moscow, Idaho",,image,https://latahcountyhistory.sfo3.digitaloceanspaces.com/moscow/01-03-634.jpg,https://latahcountyhistory.sfo3.digitaloceanspaces.com/moscow/small/01-03-634_sm.jpg,https://latahcountyhistory.sfo3.digitaloceanspaces.com/moscow/thumbs/01-03-634_th.jpg
01-03-639,01-03-639,,,Latah County Grain Growers Main Office demolition,"The skeleton walls that remain during demolition of the main office, on 6th Street, of the Latah County Grain Growers buildings",Julie Monroe,"Moscow, Idaho",2002,2002,,Image;StillImage,PHOTOGRAPH,image/jpeg,Grain growers; Office; Demolition; Truck; Moscow; Idaho,Grain growers,Office,Demolition,Truck,Moscow,Idaho,01-03-639.jpg,01-03-639,"Copyright, Latah County Historical Society Collections.  All Rights reserved, contact the Latah County Historical Society for reproduction information.","Moscow, Idaho",,image,https://latahcountyhistory.sfo3.digitaloceanspaces.com/moscow/01-03-639.jpg,https://latahcountyhistory.sfo3.digitaloceanspaces.com/moscow/small/01-03-639_sm.jpg,https://latahcountyhistory.sfo3.digitaloceanspaces.com/moscow/thumbs/01-03-639_th.jpg
01-03-644,01-03-644,,,Mosocw Food Co-op,Moscow Food Co-op interior entryway.  221 East Third Street.,Julie Monroe,"Moscow, Idaho",2002-11,2002-11,,Image;StillImage,PHOTOGRAPH,image/jpeg,Food Coop; Grocery; Moscow; Idaho,Food Coop,Grocery,Moscow,Idaho,,,01-03-644.jpg,01-03-644,"Copyright, Latah County Historical Society Collections.  All Rights reserved, contact the Latah County Historical Society for reproduction information.","Moscow, Idaho",,image,https://latahcountyhistory.sfo3.digitaloceanspaces.com/moscow/01-03-644.jpg,https://latahcountyhistory.sfo3.digitaloceanspaces.com/moscow/small/01-03-644_sm.jpg,https://latahcountyhistory.sfo3.digitaloceanspaces.com/moscow/thumbs/01-03-644_th.jpg
01-03-646,01-03-646,,,Corner Drug Store interior,"Interior of Corner Drug Store, at Third and Main Sts., Moscow.  Owner: Charles Bolles",,"Moscow, Idaho",1940,1940,1945,Image;StillImage,PHOTOGRAPH,image/jpeg,Drug Store; Corner Drug; Display counters; Tile floor; Moscow; Idaho,Drug store,Corner Drug,Display counters,Tile floor,Moscow,Idaho,01-03-646.jpg,01-03-646,"Copyright, Latah County Historical Society Collections.  All Rights reserved, contact the Latah County Historical Society for reproduction information.","Moscow, Idaho",,image,https://latahcountyhistory.sfo3.digitaloceanspaces.com/moscow/01-03-646.jpg,https://latahcountyhistory.sfo3.digitaloceanspaces.com/moscow/small/01-03-646_sm.jpg,https://latahcountyhistory.sfo3.digitaloceanspaces.com/moscow/thumbs/01-03-646_th.jpg
01-03-648,01-03-648,,,City Hotel,"City Hotel in Moscow at the corner of Main and A Streets.  When first built, it was owned by Abraham A.J. Frye and called the Frye Hotel.  After the business changed hands, it was named the City Hotel.  Fire destroyed the building in 1890 and William Carter and William A. Ladd replaced it with a brick building, renamed the Commercial Hotel.  Lodgers and staff are on the front porch.  Meals were 25 cents, all-you-can-eat.",,"Moscow, Idaho",1880,1880,1885,Image;StillImage,PHOTOGRAPH,image/jpeg,Hotels; Hotel employees; Board sidewalks; Frame building; Moscow; Idaho,Hotels,Hotel employees,Board sidewalk,Frame building,Moscow,Idaho,01-03-648.jpg,01-03-648,"Copyright, Latah County Historical Society Collections.  All Rights reserved, contact the Latah County Historical Society for reproduction information.","Moscow, Idaho",,image,https://latahcountyhistory.sfo3.digitaloceanspaces.com/moscow/01-03-648.jpg,https://latahcountyhistory.sfo3.digitaloceanspaces.com/moscow/small/01-03-648_sm.jpg,https://latahcountyhistory.sfo3.digitaloceanspaces.com/moscow/thumbs/01-03-648_th.jpg
01-03-649,01-03-649,,,Railroad Depot,Union Pacific/Northern Pacific Depot on 6th Street west of Main.,,"Moscow, Idaho",1950,1950,1960,Image;StillImage,PHOTOGRAPH,image/jpeg,Trains; Railroad; Depot; Moscow; Idaho,Trains,Railroad,Depot,Moscow,Idaho,,01-03-649.jpg,01-03-649,"Copyright, Latah County Historical Society Collections.  All Rights reserved, contact the Latah County Historical Society for reproduction information.","Moscow, Idaho",,image,https://latahcountyhistory.sfo3.digitaloceanspaces.com/moscow/01-03-649.jpg,https://latahcountyhistory.sfo3.digitaloceanspaces.com/moscow/small/01-03-649_sm.jpg,https://latahcountyhistory.sfo3.digitaloceanspaces.com/moscow/thumbs/01-03-649_th.jpg
01-03-650,01-03-650,,,General Motors garage,"General Motors dealer's garage. Note on photo says 1914 Buick. Shown in picture: Harry Smith, Oscar Nelson, Jim Richard, Elmer Nichols, Hunt Potter, Jerry Gelwick",,"Moscow, Idaho",1914,1914,,Image;StillImage,PHOTOGRAPH,image/jpeg,Cars; Automobiles; Garage; Buick; Moscow; Idaho,Cars,Automobiles,Garage,Buick,Moscow,Idaho,01-03-650.jpg,01-03-650,"Copyright, Latah County Historical Society Collections.  All Rights reserved, contact the Latah County Historical Society for reproduction information.","Moscow, Idaho",,image,https://latahcountyhistory.sfo3.digitaloceanspaces.com/moscow/01-03-650.jpg,https://latahcountyhistory.sfo3.digitaloceanspaces.com/moscow/small/01-03-650_sm.jpg,https://latahcountyhistory.sfo3.digitaloceanspaces.com/moscow/thumbs/01-03-650_th.jpg
01-03-651,01-03-651,,,General Motors garage,General Motors dealer's garage. Studebaker and Hudson cars are parked inside.  Four unidentified men are posing for the photo,,"Moscow, Idaho",1914,1914,,Image;StillImage,PHOTOGRAPH,image/jpeg,Cars; Automobiles; Garage; Rafters; Concrete floor; Moscow,Cars,Automobiles,Garage,Rafters,Concrete floor,Moscow,01-03-651.jpg,01-03-651,"Copyright, Latah County Historical Society Collections.  All Rights reserved, contact the Latah County Historical Society for reproduction information.","Moscow, Idaho",,image,https://latahcountyhistory.sfo3.digitaloceanspaces.com/moscow/01-03-651.jpg,https://latahcountyhistory.sfo3.digitaloceanspaces.com/moscow/small/01-03-651_sm.jpg,https://latahcountyhistory.sfo3.digitaloceanspaces.com/moscow/thumbs/01-03-651_th.jpg
01-03-652,01-03-652,,,Ford Agency,"Model T Ford Agency at !st and Main St. in Moscow, ID shows Leon ""Bill"" Smith and Harry Smith at Tim Sullivan's garage.",,"Moscow, Idaho",1914,1914,,Image;StillImage,PHOTOGRAPH,image/jpeg,Cars; Automobiles; Garage; Ford Model T; Moscow; Idaho,Cars,Automobiles,Garage,Model T Ford,Moscow,Idaho,01-03-652.jpg,01-03-652,"Copyright, Latah County Historical Society Collections.  All Rights reserved, contact the Latah County Historical Society for reproduction information.","Moscow, Idaho",,image,https://latahcountyhistory.sfo3.digitaloceanspaces.com/moscow/01-03-652.jpg,https://latahcountyhistory.sfo3.digitaloceanspaces.com/moscow/small/01-03-652_sm.jpg,https://latahcountyhistory.sfo3.digitaloceanspaces.com/moscow/thumbs/01-03-652_th.jpg
01-03-653,01-03-653,,,Smith Confectionary,"Smith Confectionary and Delivery Service at 309 S. Main Street, with Harry E. Smith and Bert Zumwalt standing in the doorway.  This is next to the Moscow Hotel, on the north end of the hotel building.",,"Moscow, Idaho",1911,1911,,Image;StillImage,PHOTOGRAPH,image/jpeg,Confectionary; Block building; Men's fashion; Advertising sign; Moscow; Idaho,Confectionary,Block building,Men's fashion,Advertising sign,Moscow,Idaho,01-03-653.jpg,01-03-653,"Copyright, Latah County Historical Society Collections.  All Rights reserved, contact the Latah County Historical Society for reproduction information.","Moscow, Idaho",,image,https://latahcountyhistory.sfo3.digitaloceanspaces.com/moscow/01-03-653.jpg,https://latahcountyhistory.sfo3.digitaloceanspaces.com/moscow/small/01-03-653_sm.jpg,https://latahcountyhistory.sfo3.digitaloceanspaces.com/moscow/thumbs/01-03-653_th.jpg
01-03-654,01-03-654,,,Gritman Hospital,Gritman Memorial Hospital on South Main Street. Cars parked in front.,,"Moscow, Idaho",1940,1940,1945,Image;StillImage,PHOTOGRAPH,image/jpeg,Hospital; Cars; Automobiles; Brick buildings; Moscow; Idaho,Hospital,Cars,Automobiles,Brick building,Moscow,Idaho,01-03-654.jpg,01-03-654,"Copyright, Latah County Historical Society Collections.  All Rights reserved, contact the Latah County Historical Society for reproduction information.","Moscow, Idaho",,image,https://latahcountyhistory.sfo3.digitaloceanspaces.com/moscow/01-03-654.jpg,https://latahcountyhistory.sfo3.digitaloceanspaces.com/moscow/small/01-03-654_sm.jpg,https://latahcountyhistory.sfo3.digitaloceanspaces.com/moscow/thumbs/01-03-654_th.jpg
01-03-655,01-03-655,,,Moscow Hotel,"Moscow Hotel, northwest corner of 4th and Main Streets, in the late 1940s or early 1950s.  Wrights Fountain and Murphy & Gross businesses on the first floor of the building.  In background on Jackson Street is Tri-State Distributors War Surplus store.",,"Moscow, Idaho",1940,1940,1950,Image;StillImage,PHOTOGRAPH,image/jpeg,Moscow Hotel; Cars; Street Lights; Brick buildings; Moscow; Idaho,Hotel Moscow,Cars,Street lights,Brick building,Moscow,Idaho,01-03-655.jpg,01-03-655,"Copyright, Latah County Historical Society Collections.  All Rights reserved, contact the Latah County Historical Society for reproduction information.","Moscow, Idaho",,image,https://latahcountyhistory.sfo3.digitaloceanspaces.com/moscow/01-03-655.jpg,https://latahcountyhistory.sfo3.digitaloceanspaces.com/moscow/small/01-03-655_sm.jpg,https://latahcountyhistory.sfo3.digitaloceanspaces.com/moscow/thumbs/01-03-655_th.jpg
01-03-660,01-03-660,,,Ford Garage,"Ford Garage on the west side of N. Main St., Moscow (Harry Smith, 2nd from left)",,"Moscow, Idaho",1915,1915,,Image;StillImage,PHOTOGRAPH,image/jpeg,Garage; Fashion; Apparel; Brick buildings; Ford; Moscow,Garage,Fashion,Apparel,Brick building,Ford,Moscow,01-03-660.jpg,01-03-660,"Copyright, Latah County Historical Society Collections.  All Rights reserved, contact the Latah County Historical Society for reproduction information.","Moscow, Idaho",,image,https://latahcountyhistory.sfo3.digitaloceanspaces.com/moscow/01-03-660.jpg,https://latahcountyhistory.sfo3.digitaloceanspaces.com/moscow/small/01-03-660_sm.jpg,https://latahcountyhistory.sfo3.digitaloceanspaces.com/moscow/thumbs/01-03-660_th.jpg
01-03-661,01-03-661,,,Latah County Library van,Latah County Library van,,"Moscow, Idaho",1988,1988,1990,Image;StillImage,PHOTOGRAPH,image/jpeg,Library van; Vehicle; Moscow; Idaho,Library van,Vehicle,Moscow,Idaho,,,01-03-661.jpg,01-03-661,"Copyright, Latah County Historical Society Collections.  All Rights reserved, contact the Latah County Historical Society for reproduction information.","Moscow, Idaho",,image,https://latahcountyhistory.sfo3.digitaloceanspaces.com/moscow/01-03-661.jpg,https://latahcountyhistory.sfo3.digitaloceanspaces.com/moscow/small/01-03-661_sm.jpg,https://latahcountyhistory.sfo3.digitaloceanspaces.com/moscow/thumbs/01-03-661_th.jpg
01-03-662,01-03-662,,,Latah County Library puppet show,Latah County Library puppet show,,"Moscow, Idaho",1988,1988,,Image;StillImage,PHOTOGRAPH,image/jpeg,Library; Puppet show; Children; Moscow; Idaho,Library  ,Puppet show,Children,Moscow,Idaho,,01-03-662.jpg,01-03-662,"Copyright, Latah County Historical Society Collections.  All Rights reserved, contact the Latah County Historical Society for reproduction information.","Moscow, Idaho",,image,https://latahcountyhistory.sfo3.digitaloceanspaces.com/moscow/01-03-662.jpg,https://latahcountyhistory.sfo3.digitaloceanspaces.com/moscow/small/01-03-662_sm.jpg,https://latahcountyhistory.sfo3.digitaloceanspaces.com/moscow/thumbs/01-03-662_th.jpg
01-03-663,01-03-663,,,Grain elevator,Grain elevator in Moscow,,"Moscow, Idaho",1980,1980,1990,Image;StillImage,PHOTOGRAPH,image/jpeg,Elevator; Moscow; Idaho,Elevator,Moscow,Idaho,,,,01-03-663.jpg,01-03-663,"Copyright, Latah County Historical Society Collections.  All Rights reserved, contact the Latah County Historical Society for reproduction information.","Moscow, Idaho",,image,https://latahcountyhistory.sfo3.digitaloceanspaces.com/moscow/01-03-663.jpg,https://latahcountyhistory.sfo3.digitaloceanspaces.com/moscow/small/01-03-663_sm.jpg,https://latahcountyhistory.sfo3.digitaloceanspaces.com/moscow/thumbs/01-03-663_th.jpg
01-03-664,01-03-664,,,Smith's Shell Station,"Harry Smith sweeping the Smith Bros. Shell Gas Station at the corner of 8th & Main Sts, Moscow Gritman Hospital is across the street, and in the upper left is Matz Motors (now McCoy Plumbing) donor: Wes Smith",,"Moscow, Idaho",1950,1950,1960,Image;StillImage,PHOTOGRAPH,image/jpeg,Gas station; Garage; Harry Smith; Gas pumps; Gritman Hospital; Moscow,Gas station,Garage,Harry Smith,Gas pumps,Gritman Hospital,Moscow,01-03-664.jpg,01-03-664,"Copyright, Latah County Historical Society Collections.  All Rights reserved, contact the Latah County Historical Society for reproduction information.","Moscow, Idaho",,image,https://latahcountyhistory.sfo3.digitaloceanspaces.com/moscow/01-03-664.jpg,https://latahcountyhistory.sfo3.digitaloceanspaces.com/moscow/small/01-03-664_sm.jpg,https://latahcountyhistory.sfo3.digitaloceanspaces.com/moscow/thumbs/01-03-664_th.jpg
01-03-665,01-03-665,,,Smith's Shell Station,Smith Bros. Shell Gas Station at the NW corner of 8th & Main Streets.   Mark P. Miller warehouse is in the background.,,"Moscow, Idaho",1950,1950,1960,Image;StillImage,PHOTOGRAPH,image/jpeg,Gas station; Garage; Harry Smith; Gas pumps; Grain elevators; Moscow,Gas station,Garage,Harry Smith,Gas pumps,Grain elevators,Moscow,01-03-665.jpg,01-03-665,"Copyright, Latah County Historical Society Collections.  All Rights reserved, contact the Latah County Historical Society for reproduction information.","Moscow, Idaho",,image,https://latahcountyhistory.sfo3.digitaloceanspaces.com/moscow/01-03-665.jpg,https://latahcountyhistory.sfo3.digitaloceanspaces.com/moscow/small/01-03-665_sm.jpg,https://latahcountyhistory.sfo3.digitaloceanspaces.com/moscow/thumbs/01-03-665_th.jpg
01-03-666,01-03-666,,,Union Oil Dealer,"Union Oil Dealer at the NE corner of 7th and Main (later Matz Motors, then McCoy Plumbing). In 1943 Harry Smith was the manager of the station.",,"Moscow, Idaho",1943,1943,,Image;StillImage,PHOTOGRAPH,image/jpeg,Matz Motors; Gas station; Garage; Harry Smith; McCoy Plumbing; Moscow,Matz Motors,Gas station,Garage,Harry Smith,McCoy Plumbing,Moscow,01-03-666.jpg,01-03-666,"Copyright, Latah County Historical Society Collections.  All Rights reserved, contact the Latah County Historical Society for reproduction information.","Moscow, Idaho",,image,https://latahcountyhistory.sfo3.digitaloceanspaces.com/moscow/01-03-666.jpg,https://latahcountyhistory.sfo3.digitaloceanspaces.com/moscow/small/01-03-666_sm.jpg,https://latahcountyhistory.sfo3.digitaloceanspaces.com/moscow/thumbs/01-03-666_th.jpg
01-03-667,01-03-667,,,Creighton's Store,"Creighton's Dry Goods, Shoes and Clothing Store on the west side of South Main Street. Dr. Adair's name is on the second story window.  Sign in store window reads ""The Great Red Tag Reduction Sale.""  A group of 11 people (employees?) stands outside the store.",,"Moscow, Idaho",1930,1930,1935,Image;StillImage,PHOTOGRAPH,image/jpeg,Clothing store; Storefront; Creighton's; Fashion; Moscow; Idaho,Clothing store,Storefront,Creighton's,Fashion,Moscow,Idaho,01-03-667.jpg,01-03-667,"Copyright, Latah County Historical Society Collections.  All Rights reserved, contact the Latah County Historical Society for reproduction information.","Moscow, Idaho",,image,https://latahcountyhistory.sfo3.digitaloceanspaces.com/moscow/01-03-667.jpg,https://latahcountyhistory.sfo3.digitaloceanspaces.com/moscow/small/01-03-667_sm.jpg,https://latahcountyhistory.sfo3.digitaloceanspaces.com/moscow/thumbs/01-03-667_th.jpg
01-03-668,01-03-668,,,"Hotel Idaho, Ad Club and Elk's Temple","Hotel Idaho on left, which housed a bar called Ad Club, on SE corner of Main and A Streets.  Elk's Temple is in center of picture and to the right is a small building that once housed White Drug.",,"Moscow, Idaho",1940,1940,1945,Image;StillImage,PHOTOGRAPH,image/jpeg,Cars; Hotel; BPOE Elks; Bar; Moscow; Idaho,Car,Hotel,BPOE Elks,Bar,Moscow,Idaho,01-03-668.jpg,01-03-668,"Copyright, Latah County Historical Society Collections.  All Rights reserved, contact the Latah County Historical Society for reproduction information.","Moscow, Idaho",,image,https://latahcountyhistory.sfo3.digitaloceanspaces.com/moscow/01-03-668.jpg,https://latahcountyhistory.sfo3.digitaloceanspaces.com/moscow/small/01-03-668_sm.jpg,https://latahcountyhistory.sfo3.digitaloceanspaces.com/moscow/thumbs/01-03-668_th.jpg
01-03-669,01-03-669,,,Elk's Golf Course,Women playing golf on the Elk's course off the Troy Hwy (State Hwy 8) east of Moscow at the corner of Mill Road and Hwy 8.,,"Moscow, Idaho",1950,1950,1955,Image;StillImage,PHOTOGRAPH,image/jpeg,Golf course; Landscape; Moscow; Idaho,Golf course,Landscape,Moscow,Idaho,,,01-03-669.jpg,01-03-669,"Copyright, Latah County Historical Society Collections.  All Rights reserved, contact the Latah County Historical Society for reproduction information.","Moscow, Idaho",,image,https://latahcountyhistory.sfo3.digitaloceanspaces.com/moscow/01-03-669.jpg,https://latahcountyhistory.sfo3.digitaloceanspaces.com/moscow/small/01-03-669_sm.jpg,https://latahcountyhistory.sfo3.digitaloceanspaces.com/moscow/thumbs/01-03-669_th.jpg
01-03-681,01-03-681,,,Hodgin's Drug,Interior of Hodgins Drug on Main Street,,"Moscow, Idaho",1990,1990,,Image;StillImage,PHOTOGRAPH,image/jpeg,Hodgins Drug; Moscow; Idaho,Hodgins Drug,Moscow,Idaho,,,,01-03-681.jpg,01-03-681,"Copyright, Latah County Historical Society Collections.  All Rights reserved, contact the Latah County Historical Society for reproduction information.","Moscow, Idaho",,image,https://latahcountyhistory.sfo3.digitaloceanspaces.com/moscow/01-03-681.jpg,https://latahcountyhistory.sfo3.digitaloceanspaces.com/moscow/small/01-03-681_sm.jpg,https://latahcountyhistory.sfo3.digitaloceanspaces.com/moscow/thumbs/01-03-681_th.jpg
01-03-685,01-03-685,,,Creighton's Department Store,"Exterior of Creighton's Department Store, Moscow, ID",,"Moscow, Idaho",1950,1950,1955,Image;StillImage,PHOTOGRAPH,image/jpeg,Clothing store; Creighton's; Cars; Moscow; Idaho,Clothing store,Creighton's,Cars,Moscow,Idaho,,01-03-685.jpg,01-03-685,"Copyright, Latah County Historical Society Collections.  All Rights reserved, contact the Latah County Historical Society for reproduction information.","Moscow, Idaho",,image,https://latahcountyhistory.sfo3.digitaloceanspaces.com/moscow/01-03-685.jpg,https://latahcountyhistory.sfo3.digitaloceanspaces.com/moscow/small/01-03-685_sm.jpg,https://latahcountyhistory.sfo3.digitaloceanspaces.com/moscow/thumbs/01-03-685_th.jpg
01-03-688,01-03-688,,,Creighton's Department Store interior,"Interior of Creighton's Department Store, Moscow, ID (Women's Dresses Dept)",,"Moscow, Idaho",1955,1955,1960,Image;StillImage,PHOTOGRAPH,image/jpeg,Clothing store; Creighton's; Dresses; Moscow; Idaho,Clothing store,Creighton's,Dresses,Moscow,Idaho,,01-03-688.jpg,01-03-688,"Copyright, Latah County Historical Society Collections.  All Rights reserved, contact the Latah County Historical Society for reproduction information.","Moscow, Idaho",,image,https://latahcountyhistory.sfo3.digitaloceanspaces.com/moscow/01-03-688.jpg,https://latahcountyhistory.sfo3.digitaloceanspaces.com/moscow/small/01-03-688_sm.jpg,https://latahcountyhistory.sfo3.digitaloceanspaces.com/moscow/thumbs/01-03-688_th.jpg
01-03-693,01-03-693,,,Creighton's Department Store clerks,"Exterior of Creighton's Department Store, Moscow, ID Four women in front of store: Mrs. Larson, Evelyn Hewitt, Violet Smith, Mrs. Hughes",,"Moscow, Idaho",1960,1960,1965,Image;StillImage,PHOTOGRAPH,image/jpeg,Creighton's; Clothing store; Fashion; Dresses; Moscow,Creighton's,Clothing store,Fashion,Dresses,Moscow,,01-03-693.jpg,01-03-693,"Copyright, Latah County Historical Society Collections.  All Rights reserved, contact the Latah County Historical Society for reproduction information.","Moscow, Idaho",,image,https://latahcountyhistory.sfo3.digitaloceanspaces.com/moscow/01-03-693.jpg,https://latahcountyhistory.sfo3.digitaloceanspaces.com/moscow/small/01-03-693_sm.jpg,https://latahcountyhistory.sfo3.digitaloceanspaces.com/moscow/thumbs/01-03-693_th.jpg
01-03-697,01-03-697,,,Washburn/Wilson office interior,"Office employees sitting at their desks in the Washburn Wilson office.  Roland Hill left rear, Harold Jacobs front right.",,,1955,1955,1960,Image;StillImage,PHOTOGRAPH,image/jpeg,Office; Washburn-Wilson; Moscow; Idaho,Office,Washburn/Wilson,Moscow,Idaho,,,,,"Copyright, Latah County Historical Society Collections.  All Rights reserved, contact the Latah County Historical Society for reproduction information.","Moscow, Idaho",,image,https://latahcountyhistory.sfo3.digitaloceanspaces.com/moscow/01-03-697.jpg,https://latahcountyhistory.sfo3.digitaloceanspaces.com/moscow/small/01-03-697_sm.jpg,https://latahcountyhistory.sfo3.digitaloceanspaces.com/moscow/thumbs/01-03-697_th.jpg
01-03-706,01-03-706,,,Scale/Pit House construction,Scale/pit house construction at 6th and Jackson streets: Morrill Construction building it in the late 1940s.,,"Moscow, Idaho",1945,1945,1950,Image;StillImage,PHOTOGRAPH,image/jpeg,Grain Elevator; Construction; Pit house; Moscow; Idaho,Grain elevator,Construction,Pit house,Moscow,Idaho,,01-03-706.jpg,01-03-706,"Copyright, Latah County Historical Society Collections.  All Rights reserved, contact the Latah County Historical Society for reproduction information.","Moscow, Idaho",,image,https://latahcountyhistory.sfo3.digitaloceanspaces.com/moscow/01-03-706.jpg,https://latahcountyhistory.sfo3.digitaloceanspaces.com/moscow/small/01-03-706_sm.jpg,https://latahcountyhistory.sfo3.digitaloceanspaces.com/moscow/thumbs/01-03-706_th.jpg
01-03-707,01-03-707,,,Morrill construction crew for Scale/Pit House,"Scale/pit house at 6th and Jackson streets and the Morrill Construction crew: Loyal Talbott, Foreman, 2nd row extreme right Robert Hatch, 1st row, 3rd from left Ivan Talbott, seated in Robert Hatch's lap.",John Talbott,"Moscow, Idaho",1945,1945,1950,Image;StillImage,PHOTOGRAPH,image/jpeg,Grain Elevator; Work crew; Pit house; Moscow; Idaho,Grain elevator,Work crew,Pit house,Moscow,Idaho,,01-03-707.jpg,01-03-707,"Copyright, Latah County Historical Society Collections.  All Rights reserved, contact the Latah County Historical Society for reproduction information.","Moscow, Idaho",,image,https://latahcountyhistory.sfo3.digitaloceanspaces.com/moscow/01-03-707.jpg,https://latahcountyhistory.sfo3.digitaloceanspaces.com/moscow/small/01-03-707_sm.jpg,https://latahcountyhistory.sfo3.digitaloceanspaces.com/moscow/thumbs/01-03-707_th.jpg
01-03-708,01-03-708,,,Scale/Pit House demolition,Scale/pit house at 6th and Jackson streets: demolition,,"Moscow, Idaho",2008,2008,,Image;StillImage,PHOTOGRAPH,image/jpeg,Grain Elevator; Demolition; Pit house; Moscow; Idaho,Grain elevator,Demolition,Pit house,Moscow,Idaho,,01-03-708.jpg,01-03-708,"Copyright, Latah County Historical Society Collections.  All Rights reserved, contact the Latah County Historical Society for reproduction information.","Moscow, Idaho",,image,https://latahcountyhistory.sfo3.digitaloceanspaces.com/moscow/01-03-708.jpg,https://latahcountyhistory.sfo3.digitaloceanspaces.com/moscow/small/01-03-708_sm.jpg,https://latahcountyhistory.sfo3.digitaloceanspaces.com/moscow/thumbs/01-03-708_th.jpg
01-03-714,01-03-714,,,Moscow's Community Center,"Mayor Paul Mann standing outside of Moscow's Community Center, previously Moscow's U.S. Post Office at the corner of 3rd and Washington Streets.",,"Moscow, Idaho",1970,1970,1975,Image;StillImage,PHOTOGRAPH,image/jpeg,Paul Mann; Community Center; Post Office; Brick buildings; Moscow; Idaho,Paul Mann,Community Center,Post Office,Brick building,Moscow,Idaho,01-03-714.jpg,01-03-714,"Copyright, Latah County Historical Society Collections.  All Rights reserved, contact the Latah County Historical Society for reproduction information.","Moscow, Idaho",,image,https://latahcountyhistory.sfo3.digitaloceanspaces.com/moscow/01-03-714.jpg,https://latahcountyhistory.sfo3.digitaloceanspaces.com/moscow/small/01-03-714_sm.jpg,https://latahcountyhistory.sfo3.digitaloceanspaces.com/moscow/thumbs/01-03-714_th.jpg
