objectid,cross2,notes,orderid,title,description,creator,location,date,dateCreated:start,dateCreated:end,type,content_type,format,subject,subject#0,subject#1,subject#2,subject#3,subject#4,subject#5,filename,customtext:LCHSObjectID,rights,location:placename/en2,locationCreated:placename,display_template,object_location,image_small,image_thumb
01-03-208,01-03-208,,,Hotel Moscow,"Hotel Moscow postcard with postmark Jun 5, 1912 and message from ""Maude""",,"Moscow, Idaho",1912,1912,,Image;StillImage,PHOTOGRAPH,image/jpeg,Moscow Hotel; Hodgins Drug; Awnings; Brick buildings; Moscow; Idaho,Hotel Moscow,Hodgins Drug,Awnings,Brick buildings,Moscow,Idaho,01-03-208.jpg,01-03-208,,"Moscow, Idaho",,image,https://latahcountyhistory.sfo3.digitaloceanspaces.com/moscow/01-03-208.jpg,https://latahcountyhistory.sfo3.digitaloceanspaces.com/moscow/small/01-03-208_sm.jpg,https://latahcountyhistory.sfo3.digitaloceanspaces.com/moscow/thumbs/01-03-208_th.jpg
01-03-209,01-03-209,,,"The Idaho Brewing Company, Schober Brewery","Schober Brewery, or The Idaho Brewing Company as indicated on the building sign, built in 1892, later became the vinegar plant on Main and C Streets. Horses, buggies and men are posing in front of the building. One wagon has a cover labeled Artificial Ice.  Black smoke is pouring out of the chimney.  The building burned down in 1956.  For more information, see book A Great Good Country, p. 6.",Fortin,"Moscow, Idaho",1892,1892,,Image;StillImage,PHOTOGRAPH,image/jpeg,Schober Brewery; Vinegar plant; Brick buildings; Horse and buggy; Artificial ice; Moscow,Schober Brewery,Vinegar plant,Brick buildings,Horse and buggy,Artificial ice,Moscow,01-03-209.jpg,01-03-209,,"Moscow, Idaho",,image,https://latahcountyhistory.sfo3.digitaloceanspaces.com/moscow/01-03-209.jpg,https://latahcountyhistory.sfo3.digitaloceanspaces.com/moscow/small/01-03-209_sm.jpg,https://latahcountyhistory.sfo3.digitaloceanspaces.com/moscow/thumbs/01-03-209_th.jpg
01-03-210,01-03-210,,,Elk's Lodge,"Elks Lodge (B.P.O.E.) at 112 N. Main Street, built in 1905.  See book A Great Good Country for more details.",,"Moscow, Idaho",1905,1905,1915,Image;StillImage,PHOTOGRAPH,image/jpeg,Elks Club; Wooden sidewalk; Unpaved streets; Moscow; Idaho,Elks Club,Wooden sidewalk,Unpaved street,Moscow,Idaho,,01-03-210.jpg,01-03-210,,"Moscow, Idaho",,image,https://latahcountyhistory.sfo3.digitaloceanspaces.com/moscow/01-03-210.jpg,https://latahcountyhistory.sfo3.digitaloceanspaces.com/moscow/small/01-03-210_sm.jpg,https://latahcountyhistory.sfo3.digitaloceanspaces.com/moscow/thumbs/01-03-210_th.jpg
01-03-212,01-03-212,,,Idaho National Harvester Co.,"Idaho National Harvester Company, northwest corner of D and Main (later Rosauer's lot). The photo shows combines and a sign for the office building",,"Moscow, Idaho",1910,1910,1920,Image;StillImage,PHOTOGRAPH,image/jpeg,Idaho National Harvester Co.; Combines; Moscow; Idaho,Idaho National Harvester Co.,Combines,Moscow,Idaho,,,01-03-212.jpg,01-03-212,,"Moscow, Idaho",,image,https://latahcountyhistory.sfo3.digitaloceanspaces.com/moscow/01-03-212.jpg,https://latahcountyhistory.sfo3.digitaloceanspaces.com/moscow/small/01-03-212_sm.jpg,https://latahcountyhistory.sfo3.digitaloceanspaces.com/moscow/thumbs/01-03-212_th.jpg
01-03-213,01-03-213,,,Inland Motor Freight (City Transfer and Storage),"Inland Motor Freight (City Transfer & Storage) showing trucks in front of depot.  Looking east between Main and Jackson, with the fire station on the left.  Carl Smith was the proprietor and also Moscow fire chief for many years.",,"Moscow, Idaho",1930,1930,1935,Image;StillImage,PHOTOGRAPH,image/jpeg,Inland Motor Freight; City Transfer and Storage; Fire station; Trucks; Moscow; Idaho,Inland Motor Freight,City Transfer and Storage,Fire station,Trucks,Moscow,Idaho,01-03-213.jpg,01-03-213,,"Moscow, Idaho",,image,https://latahcountyhistory.sfo3.digitaloceanspaces.com/moscow/01-03-213.jpg,https://latahcountyhistory.sfo3.digitaloceanspaces.com/moscow/small/01-03-213_sm.jpg,https://latahcountyhistory.sfo3.digitaloceanspaces.com/moscow/thumbs/01-03-213_th.jpg
01-03-214,01-03-214,,,Shorty's Place,"Shorty's Place, also known as Shorty's Pool Hall, 206 South Main.   Photo was taken after the annual pea feed that Washburn Wilson Company put on at the Grange Hall.  After lunch the farmers came over to visit the pool hall at about 2 pm. Man in a white shirt in the center of the photo is C. J. ""Bud"" O'Connor, owner.",Charles Dimond,"Moscow, Idaho",1931,1931,,Image;StillImage,PHOTOGRAPH,image/jpeg,Shorty's Place; Bar; Bud O'Connor; Moscow; Idaho,Shorty's Place,Bar,Bud O'Connor,Moscow,Idaho,,01-03-214.jpg,01-03-214,,"Moscow, Idaho",,image,https://latahcountyhistory.sfo3.digitaloceanspaces.com/moscow/01-03-214.jpg,https://latahcountyhistory.sfo3.digitaloceanspaces.com/moscow/small/01-03-214_sm.jpg,https://latahcountyhistory.sfo3.digitaloceanspaces.com/moscow/thumbs/01-03-214_th.jpg
01-03-215,01-03-215,,,Coal Shed and Latah County Grain Growers Elevator,Coal shed and Latah County Grain Growers elevator.  This coal shed was later painted in 1985 with a mural for the Moscow Renaissance Fair.,David Boyd,"Moscow, Idaho",1983,1983,,Image;StillImage,PHOTOGRAPH,image/jpeg,Coal shed; Grain elevators; Latah County Grain Growers; Railroad tracks; Wooden buildings; Moscow,Coal shed,Grain elevators,Latah County Grain Growers,Railroad tracks,Wooden building,Moscow,01-03-215.jpg,01-03-215,,"Moscow, Idaho",,image,https://latahcountyhistory.sfo3.digitaloceanspaces.com/moscow/01-03-215.jpg,https://latahcountyhistory.sfo3.digitaloceanspaces.com/moscow/small/01-03-215_sm.jpg,https://latahcountyhistory.sfo3.digitaloceanspaces.com/moscow/thumbs/01-03-215_th.jpg
01-03-216,01-03-216,,,Whittier & NW Seed Company elevators,L.M. Whittier/Northwest Seed Company/Latah County Grain Growers grain elevator that was demolished in 1986,David Boyd,"Moscow, Idaho",1983,1983,,Image;StillImage,PHOTOGRAPH,image/jpeg,Grain elevators; Latah County Grain Growers; L.M. Whittier; Northwest Seed Company; Moscow; Idaho,Grain elevators,Latah County Grain Growers,L.M. Whittier,Northwest Seed Company,Moscow,Idaho,01-03-216.jpg,01-03-216,,"Moscow, Idaho",,image,https://latahcountyhistory.sfo3.digitaloceanspaces.com/moscow/01-03-216.jpg,https://latahcountyhistory.sfo3.digitaloceanspaces.com/moscow/small/01-03-216_sm.jpg,https://latahcountyhistory.sfo3.digitaloceanspaces.com/moscow/thumbs/01-03-216_th.jpg
01-03-217,01-03-217,,,Demolition of L.M. Whittier & NW Seed elevators,L. M. Whittier and Northwest Seed Elevators being demolished,David Boyd,"Moscow, Idaho",1986,1986,,Image;StillImage,PHOTOGRAPH,image/jpeg,Grain elevators; Latah County Grain Growers; L.M. Whittier; Northwest Seed Company; Demolition; Moscow,Grain elevators,Latah County Grain Growers,L.M. Whittier,Northwest Seed Company,Demolition,Moscow,01-03-217.jpg,01-03-217,,"Moscow, Idaho",,image,https://latahcountyhistory.sfo3.digitaloceanspaces.com/moscow/01-03-217.jpg,https://latahcountyhistory.sfo3.digitaloceanspaces.com/moscow/small/01-03-217_sm.jpg,https://latahcountyhistory.sfo3.digitaloceanspaces.com/moscow/thumbs/01-03-217_th.jpg
01-03-218,01-03-218,,,Demolition of L.M. Whittier & NW Seed elevators,Whittier and Northwest Seed Elevators being demolished,David Boyd,"Moscow, Idaho",1986,1986,,Image;StillImage,PHOTOGRAPH,image/jpeg,Grain elevators; Latah County Grain Growers; L.M. Whittier; Northwest Seed Company; Demolition; Moscow,Grain elevators,Latah County Grain Growers,L.M. Whittier,Northwest Seed Company,Demolition,Moscow,01-03-218.jpg,01-03-218,,"Moscow, Idaho",,image,https://latahcountyhistory.sfo3.digitaloceanspaces.com/moscow/01-03-218.jpg,https://latahcountyhistory.sfo3.digitaloceanspaces.com/moscow/small/01-03-218_sm.jpg,https://latahcountyhistory.sfo3.digitaloceanspaces.com/moscow/thumbs/01-03-218_th.jpg
01-03-219,01-03-219,,,Crites Seed Warehouse,Crites Seed Warehouse that was demolished in 1984,David Boyd,"Moscow, Idaho",1983,1983,,Image;StillImage,PHOTOGRAPH,image/jpeg,Grain elevators; Crites Seed; Railroad; Moscow; Idaho,Grain elevators,Crites Seed,Railroad,Moscow,Idaho,,01-03-219.jpg,01-03-219,,"Moscow, Idaho",,image,https://latahcountyhistory.sfo3.digitaloceanspaces.com/moscow/01-03-219.jpg,https://latahcountyhistory.sfo3.digitaloceanspaces.com/moscow/small/01-03-219_sm.jpg,https://latahcountyhistory.sfo3.digitaloceanspaces.com/moscow/thumbs/01-03-219_th.jpg
01-03-220,01-03-220,,,Union Pacific Freight Depot,"Union Pacific Freight Depot, photo taken in 1983, demolished in 1984.",David Boyd,"Moscow, Idaho",1983,1983,,Image;StillImage,PHOTOGRAPH,image/jpeg,Union Pacific; Depot; Railroad; Trains; Moscow; Idaho,Union Pacific,Depot,Railroad,Trains,Moscow,Idaho,01-03-220.jpg,01-03-220,,"Moscow, Idaho",,image,https://latahcountyhistory.sfo3.digitaloceanspaces.com/moscow/01-03-220.jpg,https://latahcountyhistory.sfo3.digitaloceanspaces.com/moscow/small/01-03-220_sm.jpg,https://latahcountyhistory.sfo3.digitaloceanspaces.com/moscow/thumbs/01-03-220_th.jpg
01-03-221,01-03-221,,,Union Pacific Freight Depot,"Union Pacific Freight Depot, showing grain elevators in background",David Boyd,"Moscow, Idaho",1983,1983,,Image;StillImage,PHOTOGRAPH,image/jpeg,Union Pacific; Depot; Railroad; Trains; Grain elevators; Moscow,Union Pacific,Depot,Railroad,Trains,Grain elevators,Moscow,01-03-221.jpg,01-03-221,,"Moscow, Idaho",,image,https://latahcountyhistory.sfo3.digitaloceanspaces.com/moscow/01-03-221.jpg,https://latahcountyhistory.sfo3.digitaloceanspaces.com/moscow/small/01-03-221_sm.jpg,https://latahcountyhistory.sfo3.digitaloceanspaces.com/moscow/thumbs/01-03-221_th.jpg
01-03-223,01-03-223,,,Jerry 's,"Jerry's confectionary and newsstand at 112 E. Third St, next to alley across from Davids' Store.  Jerry Gelwick, owner. Seven people are posing in front of the store; the woman in a white apron may be Iva Gelwick. See book A Great Good Country, p. 42 for description and also Gelwick archives at Latah County Historical Society.",,"Moscow, Idaho",1930,1930,1940,Image;StillImage,PHOTOGRAPH,image/jpeg,Jerry's; Newsstand; Confectionary; Jerry Gelwick; Iva Gelwick; Moscow,Jerry's,Newsstand,Confectionary,Jerry Gelwick,Iva Gelwick,Moscow,01-03-223.jpg,01-03-223,,"Moscow, Idaho",,image,https://latahcountyhistory.sfo3.digitaloceanspaces.com/moscow/01-03-223.jpg,https://latahcountyhistory.sfo3.digitaloceanspaces.com/moscow/small/01-03-223_sm.jpg,https://latahcountyhistory.sfo3.digitaloceanspaces.com/moscow/thumbs/01-03-223_th.jpg
01-03-224,01-03-224,,,The Natatorium,"Natatorium, November 7, 1936, at 500 South Asbury Street, Moscow's first swimming pool.  For more information, see book A Great Good Country, p. 57.",,"Moscow, Idaho",1936,1936,,Image;StillImage,PHOTOGRAPH,image/jpeg,Natatorium; Swimming pool; Moscow; Idaho,Natatorium,Swimming pool,Moscow,Idaho,,,01-03-224.jpg,01-03-224,,"Moscow, Idaho",,image,https://latahcountyhistory.sfo3.digitaloceanspaces.com/moscow/01-03-224.jpg,https://latahcountyhistory.sfo3.digitaloceanspaces.com/moscow/small/01-03-224_sm.jpg,https://latahcountyhistory.sfo3.digitaloceanspaces.com/moscow/thumbs/01-03-224_th.jpg
01-03-225,01-03-225,,,Golden Rule Store,"Interior of Golden Rule Store at 408 S. Main, which later became the 10th store of J.C. Penney chain stores.",,"Moscow, Idaho",1910,1910,1920,Image;StillImage,PHOTOGRAPH,image/jpeg,Golden Rule; JC Penney; General Store; Fabric bolts; Moscow; Idaho,Golden Rule,J.C. Penney,General Store,Fabric bolts,Moscow,Idaho,01-03-225.jpg,01-03-225,,"Moscow, Idaho",,image,https://latahcountyhistory.sfo3.digitaloceanspaces.com/moscow/01-03-225.jpg,https://latahcountyhistory.sfo3.digitaloceanspaces.com/moscow/small/01-03-225_sm.jpg,https://latahcountyhistory.sfo3.digitaloceanspaces.com/moscow/thumbs/01-03-225_th.jpg
01-03-226,01-03-226,,,"McGregor House, Gritman Hospital","The McGregor House, later the first Gritman Hospital, at 710 South Main.",,"Moscow, Idaho",1897,1897,1905,Image;StillImage,PHOTOGRAPH,image/jpeg,Gritman Hospital; McGregor House; Moscow; Idaho,Gritman Hospital,McGregor House,Moscow,Idaho,,,01-03-226.jpg,01-03-226,,"Moscow, Idaho",,image,https://latahcountyhistory.sfo3.digitaloceanspaces.com/moscow/01-03-226.jpg,https://latahcountyhistory.sfo3.digitaloceanspaces.com/moscow/small/01-03-226_sm.jpg,https://latahcountyhistory.sfo3.digitaloceanspaces.com/moscow/thumbs/01-03-226_th.jpg
01-03-227,01-03-227,,,Moscow Hotel,Moscow Hotel at 4th and Main Streets.,,"Moscow, Idaho",1900,1900,1910,Image;StillImage,PHOTOGRAPH,image/jpeg,Moscow Hotel; Brick buildings; Moscow; Idaho,Moscow Hotel,Brick buildings,Moscow,Idaho,,,01-03-227.jpg,01-03-227,,"Moscow, Idaho",,image,https://latahcountyhistory.sfo3.digitaloceanspaces.com/moscow/01-03-227.jpg,https://latahcountyhistory.sfo3.digitaloceanspaces.com/moscow/small/01-03-227_sm.jpg,https://latahcountyhistory.sfo3.digitaloceanspaces.com/moscow/thumbs/01-03-227_th.jpg
01-03-229,01-03-229,,,Neely & Sons Hudson Dealership,Neely & Sons Hudson Dealership at SE corner of 4th and Jackson,,"Moscow, Idaho",1927,1927,,Image;StillImage,PHOTOGRAPH,image/jpeg,Neeley and Sons; Auto dealership; Hudson; Brick buildings; Gas pump; Moscow,Neeley and Sons,Auto dealership,Hudson,Brick buildings,Gas pump,Moscow,01-03-229.jpg,01-03-229,,"Moscow, Idaho",,image,https://latahcountyhistory.sfo3.digitaloceanspaces.com/moscow/01-03-229.jpg,https://latahcountyhistory.sfo3.digitaloceanspaces.com/moscow/small/01-03-229_sm.jpg,https://latahcountyhistory.sfo3.digitaloceanspaces.com/moscow/thumbs/01-03-229_th.jpg
01-03-230,01-03-230,,,Neeley and Sons Garage and Auto Livery,Neely & Sons Garage and Auto Livery on SE corner of 4th and Jackson.  Five cars are parked in front of the brick building.,,"Moscow, Idaho",1920,1920,1930,Image;StillImage,PHOTOGRAPH,image/jpeg,Neeley and Sons; Garage; Auto livery; Brick buildings; Cars; Moscow,Neeley and Sons,Garage,Auto livery,Brick buildings,Cars,Moscow,01-03-230.jpg,01-03-230,,"Moscow, Idaho",,image,https://latahcountyhistory.sfo3.digitaloceanspaces.com/moscow/01-03-230.jpg,https://latahcountyhistory.sfo3.digitaloceanspaces.com/moscow/small/01-03-230_sm.jpg,https://latahcountyhistory.sfo3.digitaloceanspaces.com/moscow/thumbs/01-03-230_th.jpg
01-03-231,01-03-231,,,Color photo of Latah Care Center,"Latah Care Center with fields around it, is the site of early pioneer, William Taylor's, home and property.",,"Moscow, Idaho",1986,1986,,Image;StillImage,PHOTOGRAPH,image/jpeg,Latah Care Center; Nursing home; William Taylor; Moscow; Idaho,Latah Care Center,Nursing home,William Taylor,Moscow,Idaho,,01-03-231.jpg,01-03-231,,"Moscow, Idaho",,image,https://latahcountyhistory.sfo3.digitaloceanspaces.com/moscow/01-03-231.jpg,https://latahcountyhistory.sfo3.digitaloceanspaces.com/moscow/small/01-03-231_sm.jpg,https://latahcountyhistory.sfo3.digitaloceanspaces.com/moscow/thumbs/01-03-231_th.jpg
01-03-235,01-03-235,,,Owl Drug interior,"Interior of Owl Drug Store in its last days, with Les Howells at adding machine and R.J. Christianson at the cash register, and customers waiting at counter.",,"Moscow, Idaho",1983,1983,,Image;StillImage,PHOTOGRAPH,image/jpeg,Owl Drug; Pharmacy; Les Howells; R.J. Christianson; Moscow; Idaho,Owl Drug,Pharmacy,Les Howells,R.J. Christianson,Moscow,Idaho,01-03-235.jpg,01-03-235,,"Moscow, Idaho",,image,https://latahcountyhistory.sfo3.digitaloceanspaces.com/moscow/01-03-235.jpg,https://latahcountyhistory.sfo3.digitaloceanspaces.com/moscow/small/01-03-235_sm.jpg,https://latahcountyhistory.sfo3.digitaloceanspaces.com/moscow/thumbs/01-03-235_th.jpg
01-03-236,01-03-236,,,J. C. Penney Company,"Exterior of J.C. Penney store at 414 South Main, showing window displays and parking meters.",,"Moscow, Idaho",1960,1960,1970,Image;StillImage,PHOTOGRAPH,image/jpeg,JC Penney; Window displays; Parking Meters; Moscow; Idaho,J.C. Penney,Window displays,Parking meters,Moscow,Idaho,,01-03-236.jpg,01-03-236,,"Moscow, Idaho",,image,https://latahcountyhistory.sfo3.digitaloceanspaces.com/moscow/01-03-236.jpg,https://latahcountyhistory.sfo3.digitaloceanspaces.com/moscow/small/01-03-236_sm.jpg,https://latahcountyhistory.sfo3.digitaloceanspaces.com/moscow/thumbs/01-03-236_th.jpg
01-03-237,01-03-237,,,Security Furniture and IOOF Building,Security Furniture store in the IOOF Building,,"Moscow, Idaho",1960,1960,1970,Image;StillImage,PHOTOGRAPH,image/jpeg,Security Furniture; IOOF Building; Brick buildings; Appliances; Moscow; Idaho,Security Furniture,IOOF building,Brick buildings,Appliances,Moscow,Idaho,01-03-237.jpg,01-03-237,,"Moscow, Idaho",,image,https://latahcountyhistory.sfo3.digitaloceanspaces.com/moscow/01-03-237.jpg,https://latahcountyhistory.sfo3.digitaloceanspaces.com/moscow/small/01-03-237_sm.jpg,https://latahcountyhistory.sfo3.digitaloceanspaces.com/moscow/thumbs/01-03-237_th.jpg
01-03-238,01-03-238,,,Latah County Grain Growers Elevator with star,"An illuminated star on top of the Latah County Grain Growers elevators in Moscow, Idaho.",,"Moscow, Idaho",1980,1980,1985,Image;StillImage,PHOTOGRAPH,image/jpeg,Grain Elevator; Silo; Idaho; Moscow,Grain Elevator,Silo,Idaho,Moscow,,,01-03-238.jpg,01-03-238,,"Moscow, Idaho",,image,https://latahcountyhistory.sfo3.digitaloceanspaces.com/moscow/01-03-238.jpg,https://latahcountyhistory.sfo3.digitaloceanspaces.com/moscow/small/01-03-238_sm.jpg,https://latahcountyhistory.sfo3.digitaloceanspaces.com/moscow/thumbs/01-03-238_th.jpg
01-03-239,01-03-239,,,Ward Paint and Hardware interior,"Ward Paint and Hardware interior, 404 S. Main.  People in picture are Cope Gale, Jr; Kelly Storch; Jeffory Western",,"Moscow, Idaho",1980,1980,1985,Image;StillImage,PHOTOGRAPH,image/jpeg,Ward Paint & Hardware; Cope Gale; Kelly Storm; Jeffory Western; Moscow; Idaho,Ward Paint & Hardware,Cope Gale,Kelly Storm,Jeffory Western,Moscow,Idaho,01-03-239.jpg,01-03-239,,"Moscow, Idaho",,image,https://latahcountyhistory.sfo3.digitaloceanspaces.com/moscow/01-03-239.jpg,https://latahcountyhistory.sfo3.digitaloceanspaces.com/moscow/small/01-03-239_sm.jpg,https://latahcountyhistory.sfo3.digitaloceanspaces.com/moscow/thumbs/01-03-239_th.jpg
01-03-240,01-03-240,,,"Appaloosa Horse Club, Inc. and Museum",New site of Appaloosa Horse Club on Moscow-Pullman highway near the state line. Al Jones of Pratt Mayflower Movers carrying a sign on the day they moved from downtown to the new building.,,"Moscow, Idaho",1970,1970,1980,Image;StillImage,PHOTOGRAPH,image/jpeg,Appaloosa Horse Club; Moving; Al Jones; Moscow; Idaho,Appaloosa Horse Club,Moving,Al Jones,Moscow,Idaho,,01-03-240.jpg,01-03-240,,"Moscow, Idaho",,image,https://latahcountyhistory.sfo3.digitaloceanspaces.com/moscow/01-03-240.jpg,https://latahcountyhistory.sfo3.digitaloceanspaces.com/moscow/small/01-03-240_sm.jpg,https://latahcountyhistory.sfo3.digitaloceanspaces.com/moscow/thumbs/01-03-240_th.jpg
01-03-241,01-03-241,,,Bafus Jewelers,"Bafus Jewelers, Dan Bafus pictured with an assortment of watches.  Later Ken's Stationery was in this store at 519 S. Main.",,"Moscow, Idaho",1973,1973,,Image;StillImage,PHOTOGRAPH,image/jpeg,Bafus Jewelers; Dan Bafus; Ken's Stationery; Moscow; Idaho,Bafus Jewelers,Dan Bafus,Ken's Stationery,Moscow,Idaho,,01-03-241.jpg,01-03-241,,"Moscow, Idaho",,image,https://latahcountyhistory.sfo3.digitaloceanspaces.com/moscow/01-03-241.jpg,https://latahcountyhistory.sfo3.digitaloceanspaces.com/moscow/small/01-03-241_sm.jpg,https://latahcountyhistory.sfo3.digitaloceanspaces.com/moscow/thumbs/01-03-241_th.jpg
01-03-242,01-03-242,,,"3-D Panhandle Gems, Louise Darby owner","Louise Darby (The Garnet Lady) with some of her gems in her business, 3_D Panhandle Gems",,"Moscow, Idaho",1980,1980,1985,Image;StillImage,PHOTOGRAPH,image/jpeg,Louise Darby; 3-D Panhandle Gems; Moscow; Idaho; Montana sapphires,Louise Darby,3-D Panhandle Gems,Moscow,Idaho,Montana sapphires,,01-03-242.jpg,01-03-242,,"Moscow, Idaho",,image,https://latahcountyhistory.sfo3.digitaloceanspaces.com/moscow/01-03-242.jpg,https://latahcountyhistory.sfo3.digitaloceanspaces.com/moscow/small/01-03-242_sm.jpg,https://latahcountyhistory.sfo3.digitaloceanspaces.com/moscow/thumbs/01-03-242_th.jpg
01-03-243,01-03-243,,,Moscow Public Library interior with children at story time,"Story time with many young children sitting, led by Betsy Bybell, at Moscow Public Library",,"Moscow, Idaho",1980,1980,1990,Image;StillImage,PHOTOGRAPH,image/jpeg,Moscow Public Library; Betsy Bybell; Story time; Moscow; Idaho,Moscow Public Library,Betsy Bybell,Story time,Moscow,Idaho,,01-03-243.jpg,01-03-243,,"Moscow, Idaho",,image,https://latahcountyhistory.sfo3.digitaloceanspaces.com/moscow/01-03-243.jpg,https://latahcountyhistory.sfo3.digitaloceanspaces.com/moscow/small/01-03-243_sm.jpg,https://latahcountyhistory.sfo3.digitaloceanspaces.com/moscow/thumbs/01-03-243_th.jpg
01-03-244,01-03-244,,,Moscow Public Library,"New wing of the Moscow Public Library, with young Sara Emery sitting outside on step.",,"Moscow, Idaho",1980,1980,1990,Image;StillImage,PHOTOGRAPH,image/jpeg,Moscow Public Library; New wing; Moscow; Idaho,Moscow Public Library,New wing,Moscow,Idaho,,,01-03-244.jpg,01-03-244,,"Moscow, Idaho",,image,https://latahcountyhistory.sfo3.digitaloceanspaces.com/moscow/01-03-244.jpg,https://latahcountyhistory.sfo3.digitaloceanspaces.com/moscow/small/01-03-244_sm.jpg,https://latahcountyhistory.sfo3.digitaloceanspaces.com/moscow/thumbs/01-03-244_th.jpg
01-03-245,01-03-245,,,Schnell Tractor Company,"Schnell Tractor Company sales room, 804 S. Main.",,"Moscow, Idaho",1947,1947,,Image;StillImage,PHOTOGRAPH,image/jpeg,Schnell Tractor Company; Allis-Chalmers; Moscow; Idaho,Schnell Tractor Company,Allis-Chalmers,Moscow,Idaho,,,01-03-245.jpg,01-03-245,,"Moscow, Idaho",,image,https://latahcountyhistory.sfo3.digitaloceanspaces.com/moscow/01-03-245.jpg,https://latahcountyhistory.sfo3.digitaloceanspaces.com/moscow/small/01-03-245_sm.jpg,https://latahcountyhistory.sfo3.digitaloceanspaces.com/moscow/thumbs/01-03-245_th.jpg
01-03-246,01-03-246,,,Schnell Tractor Company,"Schnell Tractor Company shop at 804 S. Main showing Russell Kelberg, Dick Warnicke and Joe Mengelcamp working on Allis-Chalmers tractors.",,"Moscow, Idaho",1947,1947,,Image;StillImage,PHOTOGRAPH,image/jpeg,Schnell Tractor Company; Allis-Chalmers; Shop; Moscow; Idaho,Schnell Tractor Company,Allis-Chalmers,Shop,Moscow,Idaho,,01-03-246.jpg,01-03-246,,"Moscow, Idaho",,image,https://latahcountyhistory.sfo3.digitaloceanspaces.com/moscow/01-03-246.jpg,https://latahcountyhistory.sfo3.digitaloceanspaces.com/moscow/small/01-03-246_sm.jpg,https://latahcountyhistory.sfo3.digitaloceanspaces.com/moscow/thumbs/01-03-246_th.jpg
01-03-247,01-03-247,,,Johnny's Market and Royal Club Food Store,Johnny's Market and Royal Club Food Store,,"Moscow, Idaho",1970,1970,,Image;StillImage,PHOTOGRAPH,image/jpeg,Johnnie's Market; Royal Club Food Store; Moscow; Idaho,Johnny's Market,Royal Club Food Store,Moscow,Idaho,,,01-03-247.jpg,01-03-247,,"Moscow, Idaho",,image,https://latahcountyhistory.sfo3.digitaloceanspaces.com/moscow/01-03-247.jpg,https://latahcountyhistory.sfo3.digitaloceanspaces.com/moscow/small/01-03-247_sm.jpg,https://latahcountyhistory.sfo3.digitaloceanspaces.com/moscow/thumbs/01-03-247_th.jpg
01-03-248,01-03-248,,,Chamber of Commerce sign,Chamber of Commerce sign painted on side of building.,,"Moscow, Idaho",1970,1970,1980,Image;StillImage,PHOTOGRAPH,image/jpeg,Chamber of Commerce; Moscow; Idaho,Chamber of Commerce,Moscow,Idaho,,,,01-03-248.jpg,01-03-248,,"Moscow, Idaho",,image,https://latahcountyhistory.sfo3.digitaloceanspaces.com/moscow/01-03-248.jpg,https://latahcountyhistory.sfo3.digitaloceanspaces.com/moscow/small/01-03-248_sm.jpg,https://latahcountyhistory.sfo3.digitaloceanspaces.com/moscow/thumbs/01-03-248_th.jpg
01-03-249,01-03-249,,,Shorty's Place,"Shorty's Place, 206 South Main St, July 13, 1931, showing men standing and sitting at tables, some playing cards, pool tables in back. Man in white shirt with tie is C.J. ""Bud"" O'Conner, owner.  After the annual pea feed Washburn-Wilson put on at the grange hall, the farmers came over to visit the pool hall at 2 pm. Some people identified include: Arnold Lyon, Earl Wagner, Henry Knapik, Manson, Ralph Cameron, Tim McGee, Hookey McGee, Gene O'Conner, Joe Tobin, Al Martin, Al Larsen on left side, front to back.  On right side, front to back: Herb Martinson, John Jacksha, Otto Mortenson, Joe McGlaflin, Wagner, Roy Taylor, Ward Gano, John Cleary, C.J. O'Conner, John Chestnut, Glen Peterson, Staley, Ken Wallace, Joe Strang, Frank Modine, A.J. O'Conner,Charles Todd Crew, Fred Goetz, Charles Glasky. Jake Goetz, Phil Ivy",Charles Dimond,"Moscow, Idaho",1931,1931,,Image;StillImage,PHOTOGRAPH,image/jpeg,Shorty's; Pool Hall; Bud O'Connor; Bar; Moscow; Idaho,Shorty's,Pool Hall,Bud O'Connor,Bar,Moscow,Idaho,01-03-249.jpg,01-03-249,,"Moscow, Idaho",,image,https://latahcountyhistory.sfo3.digitaloceanspaces.com/moscow/01-03-249.jpg,https://latahcountyhistory.sfo3.digitaloceanspaces.com/moscow/small/01-03-249_sm.jpg,https://latahcountyhistory.sfo3.digitaloceanspaces.com/moscow/thumbs/01-03-249_th.jpg
01-03-250,01-03-250,,,Santa Claus atop the Eggan Building,"Santa on roof of the Eggan Building at the top of a fire escape ladder. Three men in windows of apartments, at southeast corner of 4th and Main Streets",,"Moscow, Idaho",1950,1950,1960,Image;StillImage,PHOTOGRAPH,image/jpeg,Eggan Apartments; Santa; Fire escape; Brick buildings; Moscow; Idaho,Eggan Apartments,Santa,Fire escape,Brick building,Moscow,Idaho,01-03-250.jpg,01-03-250,,"Moscow, Idaho",,image,https://latahcountyhistory.sfo3.digitaloceanspaces.com/moscow/01-03-250.jpg,https://latahcountyhistory.sfo3.digitaloceanspaces.com/moscow/small/01-03-250_sm.jpg,https://latahcountyhistory.sfo3.digitaloceanspaces.com/moscow/thumbs/01-03-250_th.jpg
