objectid,cross2,notes,orderid,title,description,creator,location,date,dateCreated:start,dateCreated:end,type,content_type,format,subject,subject#0,subject#1,subject#2,subject#3,subject#4,subject#5,filename,customtext:LCHSObjectID,rights,location:placename/en2,locationCreated:placename,display_template,object_location,image_small,image_thumb
01-02-288,01-02-288,,,Moscow's Free Parking Plaza,A free parking plaza in the middle of downtown with a Ford Mustang and several Ford trucks and campers.,,"Moscow, Idaho",1960,1960,1970,Image;StillImage,PHOTOGRAPH,image/jpeg,Main Street; Parking Plaza; Ford Mustang; Ford Truck; Camper; Idaho,Main Street,Parking Plaza,Ford Mustang,Ford Truck,Camper,Idaho,01-02-288.jpg,01-02-288,"Copyright, Latah County Historical Society Collections.  All Rights reserved, contact the Latah County Historical Society for reproduction information.",,,image,https://latahcountyhistory.sfo3.digitaloceanspaces.com/moscow/01-02-288.jpg,https://latahcountyhistory.sfo3.digitaloceanspaces.com/moscow/small/01-02-288_sm.jpg,https://latahcountyhistory.sfo3.digitaloceanspaces.com/moscow/thumbs/01-02-288_th.jpg
01-02-289,01-02-289,,,Putting Up Christmas Decorations,Two city employees putting up candle Christmas decorations with the Daily Idahonian in the background.,,"Moscow, Idaho",1960,1960,1970,Image;StillImage,PHOTOGRAPH,image/jpeg,Main Street; Christmas; Daily Idahonian; Decorations; Downtown; Idaho,Main Street,Christmas,Daily Idahonian,Decorations,Downtown,Idaho,01-02-289.jpg,01-02-289,"Copyright, Latah County Historical Society Collections.  All Rights reserved, contact the Latah County Historical Society for reproduction information.",,,image,https://latahcountyhistory.sfo3.digitaloceanspaces.com/moscow/01-02-289.jpg,https://latahcountyhistory.sfo3.digitaloceanspaces.com/moscow/small/01-02-289_sm.jpg,https://latahcountyhistory.sfo3.digitaloceanspaces.com/moscow/thumbs/01-02-289_th.jpg
01-02-290,01-02-290,,,Lamp Post Work,Two city employees are working on a lamp post on Main St with Darme Insurance in the distance.,,"Moscow, Idaho",1960,1960,1970,Image;StillImage,PHOTOGRAPH,image/jpeg,Main Street; Lamp Post; Darme Insurance; City Employees; Downtown; Idaho,Main Street,Lamp Post,Darme Insurance,City Employees,Downtown,Idaho,01-02-290.jpg,01-02-290,"Copyright, Latah County Historical Society Collections.  All Rights reserved, contact the Latah County Historical Society for reproduction information.",,,image,https://latahcountyhistory.sfo3.digitaloceanspaces.com/moscow/01-02-290.jpg,https://latahcountyhistory.sfo3.digitaloceanspaces.com/moscow/small/01-02-290_sm.jpg,https://latahcountyhistory.sfo3.digitaloceanspaces.com/moscow/thumbs/01-02-290_th.jpg
01-02-291,01-02-291,,,A Crowded Main Street,The East side of a crowded Main Street between 3rd Street and 4th Street in front of a drug store with Fonk's store on the right in the distance.,,"Moscow, Idaho",1960,1960,1970,Image;StillImage,PHOTOGRAPH,image/jpeg,Main Street; Drug Store; Crowds; Fonk's; Downtown; Idaho,Main Street,Drugstore,Crowds,Fonk's,Downtown,Idaho,01-02-291.jpg,01-02-291,"Copyright, Latah County Historical Society Collections.  All Rights reserved, contact the Latah County Historical Society for reproduction information.",,,image,https://latahcountyhistory.sfo3.digitaloceanspaces.com/moscow/01-02-291.jpg,https://latahcountyhistory.sfo3.digitaloceanspaces.com/moscow/small/01-02-291_sm.jpg,https://latahcountyhistory.sfo3.digitaloceanspaces.com/moscow/thumbs/01-02-291_th.jpg
01-02-292,01-02-292,,,Street Sale,A street sale on Main Street with numerous crowds and Brown's Furniture on the right.,,"Moscow, Idaho",1960,1960,1969,Image;StillImage,PHOTOGRAPH,image/jpeg,Main Street; Street Sale; Brown's Furniture; Women; Downtown; Idaho,Main Street,Street Sale,Brown's Furniture,Women,Downtown,Idaho,01-02-292.jpg,01-02-292,"Copyright, Latah County Historical Society Collections.  All Rights reserved, contact the Latah County Historical Society for reproduction information.",,,image,https://latahcountyhistory.sfo3.digitaloceanspaces.com/moscow/01-02-292.jpg,https://latahcountyhistory.sfo3.digitaloceanspaces.com/moscow/small/01-02-292_sm.jpg,https://latahcountyhistory.sfo3.digitaloceanspaces.com/moscow/thumbs/01-02-292_th.jpg
01-02-293,01-02-293,,,5th Street and Washington Street Intersection,The corner of 5th Street and Washington Street where Safeway Grocery Store and Clyde's Meats and Groceries is situated.,,"Moscow, Idaho",1960,1960,1970,Image;StillImage,PHOTOGRAPH,image/jpeg,Main Street; Washington Street; 5th Street; Safeway; Clyde's; Idaho,Main Street,Washington Street,5th Street,Safeway,Clyde's,Idaho,01-02-293.jpg,01-02-293,"Copyright, Latah County Historical Society Collections.  All Rights reserved, contact the Latah County Historical Society for reproduction information.",,,image,https://latahcountyhistory.sfo3.digitaloceanspaces.com/moscow/01-02-293.jpg,https://latahcountyhistory.sfo3.digitaloceanspaces.com/moscow/small/01-02-293_sm.jpg,https://latahcountyhistory.sfo3.digitaloceanspaces.com/moscow/thumbs/01-02-293_th.jpg
01-02-294,01-02-294,,,Kid's Play Area in Friendship Square,A wooden play structure placed in Friendship Square at 4th Street and Main Street by Moscow Hotel and the Garden Lounge with snow still on the ground.,,"Moscow, Idaho",1960,1960,1970,Image;StillImage,PHOTOGRAPH,image/jpeg,Main Street; Friendship Square; Kids; Garden Lounge; Snow; Idaho,Main Street,Friendship Square,Kids,Garden Lounge,Snow,Idaho,01-02-294.jpg,01-02-294,"Copyright, Latah County Historical Society Collections.  All Rights reserved, contact the Latah County Historical Society for reproduction information.",,,image,https://latahcountyhistory.sfo3.digitaloceanspaces.com/moscow/01-02-294.jpg,https://latahcountyhistory.sfo3.digitaloceanspaces.com/moscow/small/01-02-294_sm.jpg,https://latahcountyhistory.sfo3.digitaloceanspaces.com/moscow/thumbs/01-02-294_th.jpg
01-02-295,01-02-295,,,Two Police on Main Street,"Two police standing in the crosswalk on the Main Street and 3rd Street intersection looking south, with H&R Block and Hodgin's Drugs on the right.",,"Moscow, Idaho",1960,1960,1970,Image;StillImage,PHOTOGRAPH,image/jpeg,Main Street; H&R Block; Hodgins Drug; Police; Fonk's; Idaho,Main Street,H&R Block,Hodgin's Drug,Police,Fonk's,Idaho,01-02-295.jpg,01-02-295,"Copyright, Latah County Historical Society Collections.  All Rights reserved, contact the Latah County Historical Society for reproduction information.",,,image,https://latahcountyhistory.sfo3.digitaloceanspaces.com/moscow/01-02-295.jpg,https://latahcountyhistory.sfo3.digitaloceanspaces.com/moscow/small/01-02-295_sm.jpg,https://latahcountyhistory.sfo3.digitaloceanspaces.com/moscow/thumbs/01-02-295_th.jpg
01-02-296,01-02-296,,,2nd Annual KRPL - Police Department Volleyball Game,The 2nd Annual KRPL-Police Department Volleyball Game during the Crazy Days celebration on Main Street.,,"Moscow, Idaho",1977,1977,,Image;StillImage,PHOTOGRAPH,image/jpeg,Main Street; Crazy Days; Police; Volleyball Game; Downtown; Idaho,Main Street,Crazy Days,Police,Volleyball Game,Downtown,Idaho,01-02-296.jpg,01-02-296,"Copyright, Latah County Historical Society Collections.  All Rights reserved, contact the Latah County Historical Society for reproduction information.",,,image,https://latahcountyhistory.sfo3.digitaloceanspaces.com/moscow/01-02-296.jpg,https://latahcountyhistory.sfo3.digitaloceanspaces.com/moscow/small/01-02-296_sm.jpg,https://latahcountyhistory.sfo3.digitaloceanspaces.com/moscow/thumbs/01-02-296_th.jpg
01-02-297,01-02-297,,,Fonk's on Main Street,A bicyclist riding North on Main Street near the 5th Street intersection in front of Fonk's and the General Telephone Company.,,"Moscow, Idaho",1960,1960,1970,Image;StillImage,PHOTOGRAPH,image/jpeg,Main Street; 5th Street; Fonk's; General Telephone Company; Bicycles; Idaho,Main Street,5th Street,Fonk's,General Telephone Company,Bicycle,Idaho,01-02-297.jpg,01-02-297,"Copyright, Latah County Historical Society Collections.  All Rights reserved, contact the Latah County Historical Society for reproduction information.",,,image,https://latahcountyhistory.sfo3.digitaloceanspaces.com/moscow/01-02-297.jpg,https://latahcountyhistory.sfo3.digitaloceanspaces.com/moscow/small/01-02-297_sm.jpg,https://latahcountyhistory.sfo3.digitaloceanspaces.com/moscow/thumbs/01-02-297_th.jpg
01-02-298,01-02-298,,,West View of Main Street and Third Street,A west view of the Main Street and 3rd Street intersection with a view of the bank and stoplights.,,"Moscow, Idaho",1960,1960,1970,Image;StillImage,PHOTOGRAPH,image/jpeg,Main Street; 3rd Street; Intersection; Banks; Volkswagon; Idaho,Main Street,3rd Street,Intersection,Bank,Volkswagon,Idaho,01-02-298.jpg,01-02-298,"Copyright, Latah County Historical Society Collections.  All Rights reserved, contact the Latah County Historical Society for reproduction information.",,,image,https://latahcountyhistory.sfo3.digitaloceanspaces.com/moscow/01-02-298.jpg,https://latahcountyhistory.sfo3.digitaloceanspaces.com/moscow/small/01-02-298_sm.jpg,https://latahcountyhistory.sfo3.digitaloceanspaces.com/moscow/thumbs/01-02-298_th.jpg
01-02-299,01-02-299,,,Mayor Handel Putting Up Flags,Mayor Handel and another man standing on ladders near flags that were placed to decorate street poles for the 4th of July.,,"Moscow, Idaho",1970,1970,,Image;StillImage,PHOTOGRAPH,image/jpeg,Main Street; 4th of July; Mayor; Flags; Fred Handel; Idaho,Main Street,4th of July,Mayor,Flags,Fred Handel,Idaho,01-02-299.jpg,01-02-299,"Copyright, Latah County Historical Society Collections.  All Rights reserved, contact the Latah County Historical Society for reproduction information.",,,image,https://latahcountyhistory.sfo3.digitaloceanspaces.com/moscow/01-02-299.jpg,https://latahcountyhistory.sfo3.digitaloceanspaces.com/moscow/small/01-02-299_sm.jpg,https://latahcountyhistory.sfo3.digitaloceanspaces.com/moscow/thumbs/01-02-299_th.jpg
01-02-300,01-02-300,,,University of Idaho Students and Christmas Tree,University of Idaho students are putting up the comunity Christmas Tree in front of Scott's Flowers & Gifts and Carter's Drugs.,,"Moscow, Idaho",1970,1970,,Image;StillImage,PHOTOGRAPH,image/jpeg,Main Street; Christmas; Christmas Tree; Scott's Flowers; Carter's Drugs; Idaho,Main Street,Christmas,Christmas Tree,Scott's Flowers,Carter's Drugs,Idaho,01-02-300.jpg,01-02-300,"Copyright, Latah County Historical Society Collections.  All Rights reserved, contact the Latah County Historical Society for reproduction information.",,,image,https://latahcountyhistory.sfo3.digitaloceanspaces.com/moscow/01-02-300.jpg,https://latahcountyhistory.sfo3.digitaloceanspaces.com/moscow/small/01-02-300_sm.jpg,https://latahcountyhistory.sfo3.digitaloceanspaces.com/moscow/thumbs/01-02-300_th.jpg
01-02-301,01-02-301,,,Old Post Office on 3rd Street,The Old Post Office and parking lots situated on 3rd Street.,,"Moscow, Idaho",1970,1970,,Image;StillImage,PHOTOGRAPH,image/jpeg,Main Street; Post Office; Parking; 3rd Street; Downtown; Idaho,Main Street,Post Office,Parking,3rd Street,Downtown,Idaho,01-02-301.jpg,01-02-301,"Copyright, Latah County Historical Society Collections.  All Rights reserved, contact the Latah County Historical Society for reproduction information.",,,image,https://latahcountyhistory.sfo3.digitaloceanspaces.com/moscow/01-02-301.jpg,https://latahcountyhistory.sfo3.digitaloceanspaces.com/moscow/small/01-02-301_sm.jpg,https://latahcountyhistory.sfo3.digitaloceanspaces.com/moscow/thumbs/01-02-301_th.jpg
01-02-302,01-02-302,,,Telephone Booth on 3rd Street,A General System phone booth on 3rd street in front of the Church of the Nazarene.,,"Moscow, Idaho",1970,1970,,Image;StillImage,PHOTOGRAPH,image/jpeg,Main Street; Telephone Booth; 3rd Street; Church of the Nazarene; Downtown; Idaho,Main Street,Telephone Booth,3rd Street,Church of the Nazarene,Downtown,Idaho,01-02-302.jpg,01-02-302,"Copyright, Latah County Historical Society Collections.  All Rights reserved, contact the Latah County Historical Society for reproduction information.",,,image,https://latahcountyhistory.sfo3.digitaloceanspaces.com/moscow/01-02-302.jpg,https://latahcountyhistory.sfo3.digitaloceanspaces.com/moscow/small/01-02-302_sm.jpg,https://latahcountyhistory.sfo3.digitaloceanspaces.com/moscow/thumbs/01-02-302_th.jpg
01-02-303,01-02-303,,,Washington Street and 4th Street,Washington Street at 4th Street near the Ice Cream Parlor.,,"Moscow, Idaho",1970,1970,,Image;StillImage,PHOTOGRAPH,image/jpeg,Main Street; Washington Street; Ice Cream Parlor; Ford Fairlane 800; Downtown; Idaho,Main Street,Washington Street,Ice Cream Parlor,Ford Fairlane 800,Downtown,Idaho,01-02-303.jpg,01-02-303,"Copyright, Latah County Historical Society Collections.  All Rights reserved, contact the Latah County Historical Society for reproduction information.",,,image,https://latahcountyhistory.sfo3.digitaloceanspaces.com/moscow/01-02-303.jpg,https://latahcountyhistory.sfo3.digitaloceanspaces.com/moscow/small/01-02-303_sm.jpg,https://latahcountyhistory.sfo3.digitaloceanspaces.com/moscow/thumbs/01-02-303_th.jpg
01-02-304,01-02-304,,,Hotel Moscow Stagecoach,"A Hotel Moscow stagecoach on muddy street pulled by two horse team with the wheels buried in the much, the coach ran between the hotel and the train depot.",,"Moscow, Idaho",1886,1886,1890,Image;StillImage,PHOTOGRAPH,image/jpeg,Main Street; Moscow Hotel; Horses; Wagon; Downtown; Idaho,Main Street,Hotel Moscow,Horses,Wagon,Downtown,Idaho,01-02-304.jpg,01-02-304,"Copyright, Latah County Historical Society Collections.  All Rights reserved, contact the Latah County Historical Society for reproduction information.",,,image,https://latahcountyhistory.sfo3.digitaloceanspaces.com/moscow/01-02-304.jpg,https://latahcountyhistory.sfo3.digitaloceanspaces.com/moscow/small/01-02-304_sm.jpg,https://latahcountyhistory.sfo3.digitaloceanspaces.com/moscow/thumbs/01-02-304_th.jpg
01-02-305,01-02-305,,,Carrier Delivering the Daily Idahonian,A young newspaper carrier delivering the Daily Idahonian to a local resident.,,"Moscow, Idaho",1950,1950,,Image;StillImage,PHOTOGRAPH,image/jpeg,Main Street; Carrier; Daily Idahonian; Residential; Downtown; Idaho,Main Street,Carrier,Daily Idahonian,Residential,Downtown,Idaho,01-02-305.jpg,01-02-305,"Copyright, Latah County Historical Society Collections.  All Rights reserved, contact the Latah County Historical Society for reproduction information.",,,image,https://latahcountyhistory.sfo3.digitaloceanspaces.com/moscow/01-02-305.jpg,https://latahcountyhistory.sfo3.digitaloceanspaces.com/moscow/small/01-02-305_sm.jpg,https://latahcountyhistory.sfo3.digitaloceanspaces.com/moscow/thumbs/01-02-305_th.jpg
01-02-306,01-02-306,,,Fire on Main Street,"Fire fighters fight a fire on Main Street between Maxine's and Shorty's Beverages, Cigars, & Pool.",,"Moscow, Idaho",1953-01-31,1953-01-31,,Image;StillImage,PHOTOGRAPH,image/jpeg,Main Street; Maxine's; Shorty's; Title Building; Fire; Idaho,Main Street,Maxine's,Shorty's,Title Building,Fire,Idaho,01-02-306.jpg,01-02-306,"Copyright, Latah County Historical Society Collections.  All Rights reserved, contact the Latah County Historical Society for reproduction information.",,,image,https://latahcountyhistory.sfo3.digitaloceanspaces.com/moscow/01-02-306.jpg,https://latahcountyhistory.sfo3.digitaloceanspaces.com/moscow/small/01-02-306_sm.jpg,https://latahcountyhistory.sfo3.digitaloceanspaces.com/moscow/thumbs/01-02-306_th.jpg
01-02-307,01-02-307,,,Muddy and Hay Covered Main Street,Horses parked and eating on the side of Main Street near wagon filled with hay.,,"Moscow, Idaho",1880,1880,1910,Image;StillImage,PHOTOGRAPH,image/jpeg,Main Street; Hay; Horse Drawn Carriage; Dirt Roads; Downtown; Idaho,Main Street,Hay,Horse Drawn Carriage,Dirt Roads,Downtown,Idaho,01-02-307.jpg,01-02-307,"Copyright, Latah County Historical Society Collections.  All Rights reserved, contact the Latah County Historical Society for reproduction information.",,,image,https://latahcountyhistory.sfo3.digitaloceanspaces.com/moscow/01-02-307.jpg,https://latahcountyhistory.sfo3.digitaloceanspaces.com/moscow/small/01-02-307_sm.jpg,https://latahcountyhistory.sfo3.digitaloceanspaces.com/moscow/thumbs/01-02-307_th.jpg
01-02-309,01-02-309,,,Horse Drawn Wagon,A horse drawn wagon parked on a muddy Main Street in front of the Moscow Hotel.,,"Moscow, Idaho",1880,1880,1910,Image;StillImage,PHOTOGRAPH,image/jpeg,Main Street; Moscow Hotel; Horse Drawn Carriage; Dirt Roads; Downtown; Idaho,Main Street,Moscow Hotel,Horse Drawn Carriage,Dirt Roads,Downtown,Idaho,01-02-309.jpg,01-02-309,"Copyright, Latah County Historical Society Collections.  All Rights reserved, contact the Latah County Historical Society for reproduction information.",,,image,https://latahcountyhistory.sfo3.digitaloceanspaces.com/moscow/01-02-309.jpg,https://latahcountyhistory.sfo3.digitaloceanspaces.com/moscow/small/01-02-309_sm.jpg,https://latahcountyhistory.sfo3.digitaloceanspaces.com/moscow/thumbs/01-02-309_th.jpg
01-02-310,01-02-310,,,Post Card of Main Street,"A postcard of Main Street showing Safeway, Washington Water & Power, Fonk's, and David's.",,"Moscow, Idaho",1920,1920,1930,Image;StillImage,PHOTOGRAPH,image/jpeg,Main Street; Fonk's; Safeway; Washington Water & Power; Davids'; Idaho,Main Street,Fonk's,Safeway,Washington Water & Power,David's,Idaho,01-02-310.jpg,01-02-310,"Copyright, Latah County Historical Society Collections.  All Rights reserved, contact the Latah County Historical Society for reproduction information.",,,image,https://latahcountyhistory.sfo3.digitaloceanspaces.com/moscow/01-02-310.jpg,https://latahcountyhistory.sfo3.digitaloceanspaces.com/moscow/small/01-02-310_sm.jpg,https://latahcountyhistory.sfo3.digitaloceanspaces.com/moscow/thumbs/01-02-310_th.jpg
01-02-312,01-02-312,,,Looking South on Main Street,A south looking image of Main Street taken by Photographer Fred Taylor who was pastor of Moscow's First Baptist Church in 1900.,,"Moscow, Idaho",1900,1900,,Image;StillImage,PHOTOGRAPH,image/jpeg,Main Street; Flour and Feed; Dirt Roads; Fred Taylor; Moscow's First Baptist Church; Idaho,Main Street,Flour and Feed,Dirt Roads,Fred Taylor,Moscow's First Baptist Church,Idaho,01-02-312.jpg,01-02-312,"Copyright, Latah County Historical Society Collections.  All Rights reserved, contact the Latah County Historical Society for reproduction information.",,,image,https://latahcountyhistory.sfo3.digitaloceanspaces.com/moscow/01-02-312.jpg,https://latahcountyhistory.sfo3.digitaloceanspaces.com/moscow/small/01-02-312_sm.jpg,https://latahcountyhistory.sfo3.digitaloceanspaces.com/moscow/thumbs/01-02-312_th.jpg
01-02-313,01-02-313,,,Looking North on Main Street,A north looking image of a very muddy Main Street with the Farm & Mill Machinery building on the right.,,"Moscow, Idaho",1900,1900,,Image;StillImage,PHOTOGRAPH,image/jpeg,Main Street; Farm and Mill Machinery; North; Dirt Roads; Downtown; Idaho,Main Street,Farm and Mill Machinery,North,Dirt Roads,Downtown,Idaho,01-02-313.jpg,01-02-313,"Copyright, Latah County Historical Society Collections.  All Rights reserved, contact the Latah County Historical Society for reproduction information.",,,image,https://latahcountyhistory.sfo3.digitaloceanspaces.com/moscow/01-02-313.jpg,https://latahcountyhistory.sfo3.digitaloceanspaces.com/moscow/small/01-02-313_sm.jpg,https://latahcountyhistory.sfo3.digitaloceanspaces.com/moscow/thumbs/01-02-313_th.jpg
01-02-314,01-02-314,,,Fire Drill on Main Street,Four firemen are climbing up a ladder while other firemen drag a hose across Main Street during a fire drill.,,"Moscow, Idaho",1910,1910,1920,Image;StillImage,PHOTOGRAPH,image/jpeg,Main Street; Fire Department; Fire Drill; Fire Hose; Flags; Idaho,Main Street,Fire Department,Fire Drill,Fire Hose,Flags,Idaho,01-02-314.jpg,01-02-314,"Copyright, Latah County Historical Society Collections.  All Rights reserved, contact the Latah County Historical Society for reproduction information.",,,image,https://latahcountyhistory.sfo3.digitaloceanspaces.com/moscow/01-02-314.jpg,https://latahcountyhistory.sfo3.digitaloceanspaces.com/moscow/small/01-02-314_sm.jpg,https://latahcountyhistory.sfo3.digitaloceanspaces.com/moscow/thumbs/01-02-314_th.jpg
01-02-315,01-02-315,,,Chevrolet Garage,A Chevrolet Garage on a Main Street corner.,,"Moscow, Idaho",1925,1925,1935,Image;StillImage,PHOTOGRAPH,image/jpeg,Main Street; Chevrolet Garage; Bicycles; Downtown; Mechanic; Idaho,Main Street,Chevrolet Garage,Bicycle,Downtown,Mechanic,Idaho,01-02-315.jpg,01-02-315,"Copyright, Latah County Historical Society Collections.  All Rights reserved, contact the Latah County Historical Society for reproduction information.",,,image,https://latahcountyhistory.sfo3.digitaloceanspaces.com/moscow/01-02-315.jpg,https://latahcountyhistory.sfo3.digitaloceanspaces.com/moscow/small/01-02-315_sm.jpg,https://latahcountyhistory.sfo3.digitaloceanspaces.com/moscow/thumbs/01-02-315_th.jpg
01-02-316,01-02-316,,,Looking East on 3rd Street,Cars driving east on 3rd Street toward Main Street by Wells Fargo Bank.,,"Moscow, Idaho",1990,1990,,Image;StillImage,PHOTOGRAPH,image/jpeg,Main Street; 3rd Street; Wells Fargo; 95; Downtown; Idaho,Main Street,3rd Street,Wells Fargo,95,Downtown,Idaho,01-02-316.jpg,01-02-316,"Copyright, Latah County Historical Society Collections.  All Rights reserved, contact the Latah County Historical Society for reproduction information.",,,image,https://latahcountyhistory.sfo3.digitaloceanspaces.com/moscow/01-02-316.jpg,https://latahcountyhistory.sfo3.digitaloceanspaces.com/moscow/small/01-02-316_sm.jpg,https://latahcountyhistory.sfo3.digitaloceanspaces.com/moscow/thumbs/01-02-316_th.jpg
01-02-317,01-02-317,,,Main Street Deli,Store awnings on the right of Main Street showing the Main Street Deli across from Friendship Square.,,"Moscow, Idaho",1990,1990,,Image;StillImage,PHOTOGRAPH,image/jpeg,Main Street; Main Street Deli; Friendship Square; Toy Store; Downtown; Idaho,Main Street,Main Street Deli,Friendship Square,Toy Store,Downtown,Idaho,01-02-317.jpg,01-02-317,"Copyright, Latah County Historical Society Collections.  All Rights reserved, contact the Latah County Historical Society for reproduction information.",,,image,https://latahcountyhistory.sfo3.digitaloceanspaces.com/moscow/01-02-317.jpg,https://latahcountyhistory.sfo3.digitaloceanspaces.com/moscow/small/01-02-317_sm.jpg,https://latahcountyhistory.sfo3.digitaloceanspaces.com/moscow/thumbs/01-02-317_th.jpg
01-02-318,01-02-318,,,Farmer's Market,A fruit and vegetable vendor is unpacking their truck and setting up on Main Street for the Farmer's Market.,,"Moscow, Idaho",1990,1990,,Image;StillImage,PHOTOGRAPH,image/jpeg,Main Street; Farmer's Market; Vegetable; Fruit; Vendor; Idaho,Main Street,Farmer's Market,Vegetable,Fruit,Vendor,Idaho,01-02-318.jpg,01-02-318,"Copyright, Latah County Historical Society Collections.  All Rights reserved, contact the Latah County Historical Society for reproduction information.",,,image,https://latahcountyhistory.sfo3.digitaloceanspaces.com/moscow/01-02-318.jpg,https://latahcountyhistory.sfo3.digitaloceanspaces.com/moscow/small/01-02-318_sm.jpg,https://latahcountyhistory.sfo3.digitaloceanspaces.com/moscow/thumbs/01-02-318_th.jpg
01-02-319,01-02-319,,,Fresh Seafood Truck,A fresh seafood truck vendor set up with five coolers during the Farmer's Market.,,"Moscow, Idaho",1990,1990,,Image;StillImage,PHOTOGRAPH,image/jpeg,Main Street; Farmer's Market; Seafood; Coolers; Downtown; Idaho,Main Street,Farmer's Market,Seafood,Coolers,Downtown,Idaho,01-02-319.jpg,01-02-319,"Copyright, Latah County Historical Society Collections.  All Rights reserved, contact the Latah County Historical Society for reproduction information.",,,image,https://latahcountyhistory.sfo3.digitaloceanspaces.com/moscow/01-02-319.jpg,https://latahcountyhistory.sfo3.digitaloceanspaces.com/moscow/small/01-02-319_sm.jpg,https://latahcountyhistory.sfo3.digitaloceanspaces.com/moscow/thumbs/01-02-319_th.jpg
01-02-320,01-02-320,,,Cherry Vendor at the Farmer's Market,A farmer/vendor is selling cherries to a women during the Farmer's Market.,,"Moscow, Idaho",1990,1990,,Image;StillImage,PHOTOGRAPH,image/jpeg,Main Street; Farmer's Market; Cherries; Flowers; Downtown; Idaho,Main Street,Farmer's Market,Cherries,Flowers,Downtown,Idaho,01-02-320.jpg,01-02-320,"Copyright, Latah County Historical Society Collections.  All Rights reserved, contact the Latah County Historical Society for reproduction information.",,,image,https://latahcountyhistory.sfo3.digitaloceanspaces.com/moscow/01-02-320.jpg,https://latahcountyhistory.sfo3.digitaloceanspaces.com/moscow/small/01-02-320_sm.jpg,https://latahcountyhistory.sfo3.digitaloceanspaces.com/moscow/thumbs/01-02-320_th.jpg
01-02-321,01-02-321,,,Friendship Square Parking Lot,The crowded Friendship Square Parking Lot situated on Jackson Street between 3rd and 6th Streets.,,"Moscow, Idaho",1990,1990,,Image;StillImage,PHOTOGRAPH,image/jpeg,Main Street; Friendship Square; 3rd Street; 6th Street; Parking Lot; Idaho,Main Street,Friendship Square,3rd Street,6th Street,Parking Lot,Idaho,01-02-321.jpg,01-02-321,"Copyright, Latah County Historical Society Collections.  All Rights reserved, contact the Latah County Historical Society for reproduction information.",,,image,https://latahcountyhistory.sfo3.digitaloceanspaces.com/moscow/01-02-321.jpg,https://latahcountyhistory.sfo3.digitaloceanspaces.com/moscow/small/01-02-321_sm.jpg,https://latahcountyhistory.sfo3.digitaloceanspaces.com/moscow/thumbs/01-02-321_th.jpg
